1536,1,4,"i didn t expect the type of selection that s available for iphone or android  but i did hope that some of the java based apps out there for download would work with this phone  and only a few did.",-1,1,23,0.360425,0.106599
1536,1,5,"others that should have didn t or only worked partially.",-1,1,23,0.183139,0.045464
1536,1,6,"this is definitely a feature phone and not a smart phone.the phone did its job while it lasted.",-1,1,23,0.550173,0.097934
1536,1,7,"within a couple months  however  the touchscreen all but died.",-1,1,22,0.561510,0.100172
1536,1,8,"it was only responsive in certain parts of the screen  and even there  it registered the touch as being in a different part of the screen.",-1,1,15,0.563516,0.103078
1536,1,9,"it was within the six month warranty period  and virgin mobile sent me a new handset free of charge.",-1,1,15,0.662487,0.147057
1536,1,10,"fast forward several more months  and the exact same problem arose  only it was past the six month window since i had purchased the original handset.",-1,1,13,0.229873,0.083568
1536,1,11,"virgin mobile refused to replace the phone  even though it had been less than six months since the replacement was sent.",-1,1,24,0.251203,0.078717
1536,1,12,"i should add i m not generally hard on phones.",-1,1,24,0.578901,0.100172
1536,1,13,"i take care not to damage them  use screen protectors  etc.that lack of reliability alone and the frustration i felt trying to deal with virgin mobile customer service is enough to cause me to rate this phone as only two stars.",-1,1,20,0.664000,0.151095
1536,1,14,"add to that the lack of apps  and it s squarely only in the 2 star category.",-1,1,20,0.251239,0.047610
1536,1,15,"as of june 2012  i d say spend a little more and get one of vm s basic android phones.",-1,1,20,0.267725,0.050503
1536,1,16,"you ll be much happier.in a nutshell   pros slide out keyboardvirgin mobile s rates  especially since i use mostly data connection and very little voice decent cell signal in my area  though it could be bettercons faulty touchscreenfrustrations with vm s customer service trying to get second unit replacedlack of serviceable apps",-1,1,17,0.570456,0.096537
1537,1,0,"frustrating ui.",-1,1,17,1.000000,1.000000
1537,1,1,"decent phone  but i ve been continually frustrated by the ui for the many months i ve had it.",-1,1,17,0.057265,0.032870
1537,1,2,"why do i need to slide a touch bar and press a screen button to hang up the phone ",-1,1,16,0.551477,0.100172
1537,1,3,"if i m in the car or doing anything else  i can t work this kind of magic.",-1,1,20,0.565916,0.095158
1537,1,4,"also  good luck trying to figure out the combo of illogical buttons required to put someone on hold and then talk to them again without hanging up on them.",-1,1,16,0.554864,0.162655
1537,1,5,"i was told in the store that it doesn t butt dial...it butt dials about once week.",-1,1,17,0.572583,0.158366
1537,1,6,"want to send a quick text ",-1,1,17,0.576347,0.103078
1537,1,7,"well you will need to click through 10 screens to do it.the",-1,1,16,0.569845,0.095158
1537,1,8,"only thing i like about it is the full keypad  but with so many phones offering this option now  find one that has designed a friendlier user interface.",-1,1,16,0.570018,0.096537
1538,1,0,"decent.",-1,1,17,1.000000,1.000000
1538,1,1,"it serves its purpose but i found that i do have to take the battery out or do the shut the phone off and turn it back on trick quite often.",-1,1,16,0.541867,0.097934
1538,1,2,"it takes a while to start up  a bit longer then i would like.",-1,1,17,0.558141,0.100172
1538,1,3,"it is not good at the basement at work so i pretty much dont text on break time which is something i would have liked.",-1,1,17,0.654490,0.228910
1538,1,4,"it does work at my home tho and when i walk around town which is where i am most of the time so its not horrible.",-1,1,17,0.114009,0.064684
1538,1,5,"i like the fact that it has a touch screen and a slide out keyboard.",-1,0,6,0.662546,0.140062
1538,1,6,"i don t like the fact that it kind of pauses while your typing a message and you get an incoming message.",-1,0,6,0.304448,0.055125
1538,1,7,"reception and coverage could be better but the reception is definitely better then some i have had in the past.virgin mobile customer service usually helps with any problems i have so that inst that bad either.",-1,1,17,0.566756,0.162655
1538,1,8,"i will use my vm rumor touch till it breaks or something or i just feel i want a new phone.it was  gift and i do appreciate that.thanks mom  feel free to ask any comments in the comment box below if i can i will answer them for u.",-1,0,6,0.579762,0.160499
1539,1,0,"get a smartphone instead.",-1,1,20,1.000000,1.000000
1539,1,1,"i would not recommend the lg rumor touch.",-1,1,20,0.541954,0.162655
1539,1,2,"virgin mobile s support is minimal and customer service is not familiar with how to use the phone at all.",-1,1,24,0.652111,0.231270
1539,1,3,"the device has lots of features  but interface is extremely un intuitive and locked down  so you aren t allowed to add apps or customize it.",-1,1,24,0.295221,0.055831
1539,1,4,"although there is a video camera  it s only 2mp and lacks a flash or sound so will be crude.",-1,0,3,0.665789,0.140062
1539,1,5,"the phone does not support wifi  tethering  android  or adobe flash.",-1,0,3,0.255266,0.050503
1539,1,6,"the cpu is very slow if you have more than a few photos or mp3 in it.",-1,0,11,0.564518,0.100172
1539,1,7,"the touch screen isn t fast or precise enough   so you often end up choosing the wrong feature.",-1,0,10,0.563229,0.162655
1539,1,8,"if you want to load all your existing phone contacts there s no way to do it other than manually  and to backup your contact list you have to pay a monthly fee for the contact vault.",-1,0,2,0.565242,0.162655
1539,1,9,"also the email   im app is designed to exit from memory after a short time so you can t enjoy push technology.",-1,1,13,0.574246,0.103078
1539,1,10,"the vendor rarely comes out with software updates.",-1,1,20,0.684054,0.140062
1539,1,11,"the best thing about this phone is nice keyboard and good im software for all the major services  but a full battery charge will only last about half a day.",-1,1,20,0.373846,0.124167
1540,1,0,"monthly fees to backup your contacts and use dowloaded ringtones.",-1,0,2,1.000000,1.000000
1540,1,1,"you know the old adage  you get what you pay for.",-1,0,2,0.560554,0.103078
1540,1,2,"the good news is that the price for the plans are great and there are no contracts.",-1,0,0,0.545062,0.158366
1540,1,3,"of course there are certain drawbacks.",-1,0,2,0.568742,0.158366
1540,1,4,"you must pay for virgin s contact vault if you want to backup or import your contacts  otherwise you must enter them manually and they can t be backed up on a sim card as these phones don t use them.",-1,0,0,0.653700,0.151095
1540,1,5,"this is a huge drawback if you have a lot of contacts and don t want to be held hostage and pay for virgin s backup service.",-1,0,2,0.097180,0.037743
1540,1,6,"there aren t many preloaded ringtone and they aren t very appealing.",-1,0,2,0.679652,0.147057
1540,1,7,"this is so you will purchase ringtones from virgin and then be charged a monthly fee to use them.",-1,0,2,0.101338,0.037324
1540,1,8,"the bottom line is if you don t mind using one of their phones and having to pay monthly fees for the extras that you will almost certainly want  virgin mobile might work for you.",-1,0,7,0.384660,0.082208
1541,1,0,"bad.",-1,1,25,1.000000,1.000000
1541,1,1,"i received this delivery after i was so eager to have a replacement.",-1,1,25,0.548044,0.155053
1541,1,2,"the description says unlocked which is a lie.",-1,1,25,0.561109,0.100172
1541,1,3,"when i put my tmobile sim card in the phone and it didnt work.",-1,1,14,0.561731,0.103078
1541,1,4,"also it says music player but yet it doesn t have a slot for my headphones.",-1,1,18,0.574708,0.101615
1542,1,0,"ended up replacing it after a few months.",-1,1,22,1.000000,1.000000
1542,1,1,"let s just say that  had i bought this phone two or three years ago  i d have been happy with it.",-1,1,22,0.548512,0.158366
1542,1,2,"thought i stayed with samsung  i totally upgraded to the phone i really wanted as soon as i could.cons  the tiny tiny keys  the lack of a good clear picture  and the camera stopped working after a month.pros  it never dropped a call.",-1,1,15,0.556884,0.107177
1542,1,3,"short recharge time",-1,1,22,0.583407,0.158712
1543,1,0,"lack of shortcuts make using this phone a hassle.",-1,0,6,1.000000,1.000000
1543,1,1,"i have no problems with the small buttons and the camera is fine.",-1,0,6,0.542334,0.155053
1543,1,2,"looks nice.",-1,0,1,0.567122,0.150928
1543,1,3,"when i want to make a call or send a text however  i can t just scroll down through contacts.",-1,0,6,0.552142,0.162655
1543,1,4,"i have to go through several menu items to get to where i need to go.",-1,0,6,0.574353,0.095158
1543,1,5,"my old 2 to 3 step process has turned into a 6 7 button pushing experience just to send one test.",-1,1,13,0.561685,0.103078
1543,1,6,"also  some callers claim to hear a buzzing on their end.",-1,1,13,0.587779,0.101615
1544,1,0,"doesn t work properly.",-1,1,17,1.000000,1.000000
1544,1,1,"phone often drops calls and loses service.",-1,1,17,0.650300,0.147057
1544,1,2,"i have used other att phone in the same spots so it was not the service area.",-1,1,17,0.208705,0.049391
1544,1,3,"sometimes the calls don t even go through can the caller receives a busy signal when phone line is still open.",-1,1,17,0.562971,0.103078
1544,1,4,"again  it wasn t the phone service  all other att phones i have ever had have never had problems like this.",-1,1,17,0.579624,0.158712
1545,1,0,"horrible keyboard.",-1,1,17,1.000000,1.000000
1545,1,1,"unless you have the thinnest fingertips you will be constantly hitting two keys at the same time.",-1,1,17,0.554690,0.103078
1545,1,2,"because of this i only used it a few days before i went back to my old phone and started my search for another new one.",-1,1,18,0.570186,0.101615
1546,1,0,"not full functional.",-1,1,17,1.000000,1.000000
1546,1,1,"i ordered this phone and it would not let me receive pictures.",-1,1,17,0.551836,0.100172
1546,1,2,"the keys were too close together.",-1,1,15,0.572754,0.103078
1546,1,3,"not functional for me.",-1,1,15,0.573014,0.101615
1547,1,0,"can t change text tone to custom.",-1,0,2,1.000000,1.000000
1547,1,1,"i hope you read this before you buy   this phone looks pretty good but here s my problem   i have a custom mp3 text tone i like to use  george takei saying  oh myyy   come to find out  you can t change the text tone to anything other than the six preset beeps and bops they have programmed in ",-1,0,2,0.065895,0.034320
1547,1,2,"no way to do it  won t let you.",-1,0,12,0.572523,0.100172
1547,1,3,"soooo sad the menu is really at t  heavy as well so if you re going to use this on a t mobile network be prepared for useless menu options and the loss of your old standby t mobile options.one last thing it feels really cheap in your hands.",-1,0,12,0.556351,0.107177
1547,1,4,"not really worth the  50.",-1,0,12,0.585340,0.158712
1548,1,0,"short battery life.",-1,1,13,1.000000,1.000000
1548,1,1,"i ordered this phone a couple of weeks ago.",-1,1,25,0.550018,0.095158
1548,1,2,"so far  the battery only last 3 days without phone calls.",-1,1,13,0.660162,0.143940
1548,1,3,"i checked the battery and found the seller replaced the original samsung battery with replica.",-1,1,13,0.248718,0.068699
1548,1,4,"so  i was quite disapointed given other reviews stated with long battery life.",-1,1,13,0.187431,0.046866
1548,1,5,"check who the seller is before you order it.",-1,1,25,0.578909,0.101615
1549,1,0,"phone is locked.",-1,1,20,1.000000,1.000000
1549,1,1,"the phone was advertised as unlock.",-1,1,19,0.548044,0.103078
1549,1,2,"i took it overseas but never worked.",-1,1,20,0.567301,0.104169
1549,1,3,"it is now useless in a drawer.",-1,1,20,0.567921,0.100172
1549,1,4,"it is not worth the effort if advertisement is deceptive.",-1,1,25,0.568542,0.158712
1550,1,0,"i bought this for my daughter to replace the phone that came with the att plan we got in.",-1,1,22,1.000000,1.000000
1550,1,1,"she hated not having a qwerty keyboard.",-1,1,23,0.558535,0.162655
1550,1,2,"all in all  she likes the phone as a user  but when talking to her  there is a humm in the background coming from her new phone.",-1,1,23,0.553059,0.158366
1550,1,3,"it does not bother her so she is keeping the phone.",-1,1,15,0.570330,0.103078
1550,1,4,"but any one that calls her gets the humm in the background  kind of like static.",-1,1,17,0.558688,0.100172
1550,1,5,"it is not bad enough to interfere with the conversation  but it is a bit annoying.",-1,1,17,0.568717,0.162655
1550,1,6,"there is also an issue with picture messaging that i haven t resolved yet  she only receives the first half of a picture in a picture message.",-1,1,17,0.570483,0.152979
1551,1,0,"i bought this phone for two reasons  it was given good reviews from buyers and it was a cheap way to sign up with at t  go phone service.",-1,1,19,1.000000,1.000000
1551,1,1,"this phone makes me nervous and it s not very dependable.",-1,1,20,0.564912,0.155053
1551,1,2,"the call quality is awful.",-1,1,17,0.554898,0.097934
1551,1,3,"the alarm feature stopped working after my 30 day return period  of course .",-1,1,17,0.660380,0.147057
1551,1,4,"sure this phone is packed with features but they aren t really useful when little details are lacking.",-1,1,20,0.365959,0.079525
1552,1,0,"durable  practical phone.",-1,1,22,1.000000,1.000000
1552,1,1,"i ve had this phone for a couple years.",-1,1,22,0.543816,0.095158
1552,1,2,"i bought it new from walmart.",-1,1,22,0.558910,0.103078
1552,1,3,"it s a great phone if you just need a simple phone.",-1,1,18,0.549099,0.155053
1552,1,4,"very durable too.",-1,1,22,0.564158,0.155053
1552,1,5,"i ruined my first one because i got it wet  but another one survived after getting dropped in a pond.",-1,1,19,0.560584,0.095158
1552,1,6," p so...just take care of it ",-1,1,19,0.563207,0.103078
1552,1,7,"   i have been looking and looking to see where i can get this new  walmart has stopped selling it new  refurbished ones are sold but i haven t had good experiences with refurbished phones of this model and returned them.",-1,1,19,0.554971,0.158366
1552,1,8,"the only problem i have with it is that the internet eventually stops working.",-1,1,19,0.576149,0.155053
1552,1,9,"a straight talk representative can talk to you  though  and they ll send you a replacement phone but make sure you ask if they re sending you a refurbished one  ",-1,1,25,0.664848,0.215872
1552,1,10,"i think they pretty much send back refurbished ones  not brand new ones  s.",-1,1,25,0.126540,0.040726
1552,1,11,"then again  if you want high speed internet with media features  then this phone is not for you  it just shows basic text and small sized graphics.",-1,1,18,0.573809,0.095158
1552,1,12,"if you can buy this new  though  and just want a no frills phone  i would recommend this model.",-1,1,22,0.583774,0.160499
1553,1,0,"for the price  a good phone.",-1,0,7,1.000000,1.000000
1553,1,1,"i purchased two of these used for family members to try out straight talk s prepaid service.",-1,0,6,0.543742,0.162655
1553,1,2,"neither of them use the internet  so i can t comment on that aspect.",-1,0,7,0.562484,0.095158
1553,1,3,"they mainly use the phones to talk and text a little.",-1,0,6,0.558833,0.097934
1553,1,4,"they are both happy with the functionality of the phone  though their one complaint is the phone s ringer isn t loud enough and sometimes they miss calls.",-1,1,18,0.656828,0.147057
1553,1,5,"they are both hard of hearing  but i do think the highest setting isn t as loud as on other phones.",-1,1,18,0.234905,0.048494
1553,1,6,"other than that  though  the phone has very good call quality and they are both happy with it.",-1,0,7,0.667658,0.221309
1553,1,7,"if you are looking for a cheap phone without any bells and whistles to make calls on and the occasional text  i think this one will work for you.",-1,0,7,0.242848,0.084347
1553,1,8," and i mean no extras  in case you missed it in the description  there is no camera on this phone and no picture messaging .",-1,0,6,0.573614,0.096537
1554,1,0,"terrible customer service.",-1,1,17,1.000000,1.000000
1554,1,1,"the customer service department has no knowledge of their own product.",-1,1,24,0.051939,0.047978
1554,1,2,"i signed up for automatic refill twice and never got the refill.",-1,1,24,0.565473,0.101852
1554,1,3,"when i called customer service about the refill they told me to take the  battery out and put it back in.",-1,1,24,0.552142,0.107177
1554,1,4,"i followed her instructions and now it doesn t work at all.",-1,1,25,0.574353,0.100172
1554,1,5,"she said she would send me a new battery which i never received.",-1,1,25,0.567687,0.107177
1554,1,6,"i am now searching for a new phone and it will not be stright talk .",-1,1,17,0.580735,0.105663
1555,1,0,"exceptionally poor customer service   very poor cellphone function.",-1,0,2,1.000000,1.000000
1555,1,1,"i purchased a straighttalk phone and 30 day service card directly from straighttalk.",-1,0,2,0.344657,0.121388
1555,1,2,"i did this because i wanted to deal with the company directly and have them see me as a trusted customer.",-1,0,2,0.263080,0.054529
1555,1,3,"the fedex box arrived in good time.",-1,0,6,0.552316,0.158366
1555,1,4,"as per instructions to activate the phone  i signed onto their website to activate it.",-1,0,6,0.553947,0.158366
1555,1,5,"no luck   the phone was always reading  no service .",-1,1,17,0.660026,0.151095
1555,1,6,"i called the customer service line and waited over 1 2 hour to get someone on the phone  don t hang up and redial as this will put you at the beginning of the line again .",-1,1,17,0.248617,0.049309
1555,1,7,"no help at all  the representative was  mystified  and transferred me to his  superior .",-1,1,18,0.567682,0.155053
1555,1,8,"after a 45 minute wait  we again went through all the steps to no avail.",-1,1,13,0.554246,0.158366
1555,1,9,"this person actually got upset when i said i didn t receive a text message from him.",-1,1,17,0.663116,0.225659
1555,1,10,"since the phone had  no service  i told this manager that it was impossible to receive the message.",-1,1,17,0.137825,0.070432
1555,1,11,"after about 1 2 hour i asked to be transferred to his manager and got a  vice president  on the phone.",-1,1,17,0.274753,0.052911
1555,1,12,"zero concern  zero help  as a matter of fact i was told it was not his position to take phone calls.",-1,1,13,0.561642,0.150928
1555,1,13,"at the end of my willingness to listen to his banter  i asked for a refund and we would part company without animosity.",-1,1,17,0.675328,0.225659
1555,1,14,"he then informed me he could refund the price of the phone but not the service card as it had already been used.",-1,1,22,0.385610,0.105332
1555,1,15,"i explained that the service card had been used on this non working phone and had zero deductions.",-1,1,22,0.049127,0.029149
1555,1,16,"it didn t matter.",-1,1,22,0.579566,0.097934
1555,1,17,"only the phone would be refunded  if i prepaid the return postage.",-1,1,22,0.568865,0.095158
1555,1,18,"the vice president s quote  that s our company policy and there will be no exceptions .",-1,1,17,0.681739,0.151095
1555,1,19,"thank god i called my credit card company on the next call and they cancelled payment without hesitation.",-1,1,17,0.142451,0.064839
1555,1,20,"my advice   save your peace of mind and go with a carrier with a reputation.",-1,1,22,0.582925,0.152979
1556,1,0,"it came quicker than expected in the mail  that s about it...",-1,1,25,1.000000,1.000000
1556,1,1,"i was very excited that it came earlier that it was estimated however when i powered it on all i got was a white screen on the main screen  and when you turn the phone almost all the way up  you can faintly see the images on screen.",-1,1,16,0.550539,0.103078
1556,1,2,"i did contact the seller  they are currently giving me a refund so i basically lost the amount of cash needed to send it back.",-1,1,25,0.567098,0.101615
1557,1,0,"wrong phone.",-1,1,25,1.000000,1.000000
1557,1,1,"i returned the phone.",-1,1,25,0.555984,0.158366
1557,1,2,"product description was incorrect.",-1,1,25,0.558317,0.103078
1557,1,3,"phone said it used verizons network  but it really used att network.",-1,1,14,0.566841,0.096537
1558,1,0,"ok basic phone   useless manual.",-1,1,20,1.000000,1.000000
1558,1,1,"the phone has some exceptional multimedia features for a basic phone buta micro sd card is required to use most of the multimedia features.volume seems ok.",-1,1,21,0.270758,0.055218
1558,1,2,"battery life is better than average.",-1,1,13,0.560486,0.100172
1558,1,3,"the challenge withthis phone is the lack of instructions on setting up and using it.",-1,1,21,0.560797,0.100172
1558,1,4,"there is aninteractive guide on at least one of the amazon pages for a similar model butthe guide has had technical issues and at the time of this review has vanishedfrom the page i had saved in my wish list.",-1,1,21,0.554009,0.100172
1558,1,5,"hopefully someone may find the followinguser guide helpful.using the blu jenny t172iimportant buttons   center input button with left  right  up  down scrolling.",-1,1,16,0.665324,0.147057
1558,1,6,"soft keys   are above the answer and end call keys.turn on off   press and hold the end call key   release when on or off.menu   shortcut press left soft key.phone book   shortcut press right soft key.flashlight on off  shortcut press and hold center input button    release when on or off.change language  press left soft key   scroll down to settings  wrench symbol     scroll down to option 4 phone settings  spanish portugues  configuracion del telefono    scroll to option 2 language   spanish portugues idiorna  press center input button    scroll to english    press center input button or ok.speaker phone   press right soft key on   press right soft key again off.vibrate on off   press and hold   key  lower right corner .lock keys   at home screen press and release center input button    then quickly press   key  lower left corner  a key symbol  appears on screen.",-1,1,16,0.181095,0.045887
1558,1,7,"repeat steps to unlock keys.",-1,1,20,0.583096,0.100172
1558,1,8," to answer a call in lock mode press the answer key .",-1,1,16,0.667100,0.147057
1558,1,9," to make a call the keys must be unlocked .lock keys auto   press left soft key   scroll to settings  wrench symbol     scroll to security settings   scroll to auto keypad lock    select auto lock setting  recommend 30 seconds or more .voicemail   press and hold 1 key to set or check.ringtone volume  at home screen press up scroll key   select general    select option 2 customize   scroll to option 4  ringtone volume     press center input button   scroll right or left to  increase decrease volume.",-1,1,16,0.328093,0.117718
1559,1,0,"terrible instruction manual.",-1,1,18,1.000000,1.000000
1559,1,1,"the phone is quite small.",-1,1,13,0.557037,0.158366
1559,1,2,"the blu tank is a little thicker and has longer battery life.",-1,1,13,0.540691,0.100172
1559,1,3,"the  instructions   in addition to being little more than a summary of the phone s menus  is written with many grammar  stylistic  and usage problems.",-1,1,22,0.551375,0.162655
1559,1,4,"easier to search online for a blu jenny manual.",-1,0,6,0.550201,0.162655
1559,1,5,"same lack of information  but with larger type.",-1,0,9,0.558982,0.100172
1559,1,6,"if you are technologically feeble or logically impaired  or simply desire detailed instructions  avoid blu bar phones.first omission  how do you get into the thing to install the battery ",-1,0,6,0.546604,0.103078
1559,1,7,"at the bottom edge  there is a tiny groove into which you can stick a strong fingernail to pop the back of the case off.",-1,1,13,0.564086,0.095158
1559,1,8,"if the color of the stripe around the edges of the phone is black  this is hard to spot.",-1,1,25,0.564158,0.095158
1559,1,9,"while it is open  you can see where the sim cards go.",-1,1,18,0.555128,0.097934
1559,1,10,"just position one or both and slide them or it in.",-1,1,16,0.564715,0.155053
1559,1,11,"the tiny sd card is also easy to install if you know the top secret that is not included in the instructions.",-1,1,18,0.654861,0.221309
1559,1,12,"facing the exposed innards of the phone with the camera lens at the top  there is a little square frame at the bottom left that will hold the sd card.",-1,1,13,0.142416,0.039749
1559,1,13,"position that strong fingernail into the vertical slot in the frame  and slide the frame to the right about 1 16 of an inch.",-1,1,21,0.569155,0.158366
1559,1,14,"use the same tool to raise the frame on its hinges.",-1,1,16,0.575699,0.158366
1559,1,15,"install the cardlet and close the frame  sliding the the top back to the left.",-1,1,16,0.557219,0.097934
1559,1,16,"adding the card will enable many of the features of the phone.",-1,1,18,0.675532,0.140062
1559,1,17,"you can set the camera resolution higher  load the card with mp3 files in a folder called  my music  and load additional mp3 ringtones.i am amazed at the good quality of the fm radio.i bought the phone to use in costa rica.",-1,1,18,0.315660,0.092282
1559,1,18,"it is easy to purchase a sim there to use in this unlocked quad band phone.",-1,1,22,0.580897,0.162655
1559,1,19,"i can t tell how it works as a phone yet  since i am still in the us.i regret the absence of a headphone plug  but we will be traveling with other devices to meet that need.the absence of a manual is not all that bad.",-1,1,22,0.565500,0.155053
1559,1,20,"i just spent about 30 minutes exploring the menu and found most everything needed.",-1,1,20,0.580494,0.150928
