1377,1,8,"reception seems to be stronger with this phone than the samsung i previously had.",-1,0,6,0.570359,0.155053
1377,1,9,"it is thin enough to easily fit into my pants  pocket.",-1,0,10,0.555875,0.095158
1377,1,10,"i couldn t get my napster songs to play with the realplayer that is included with the phone but i am sure rhapsody songs would play.",-1,1,18,0.667389,0.147057
1377,1,11,"plus  i just started shopping for mp3 s from amazon  which of course play well on this phone.",-1,1,18,0.142218,0.041025
1377,1,12,"the only complaint i have is with the included synchronization software which is proprietary to most motorola phones.",-1,1,18,0.569421,0.158366
1377,1,13,"it took me almost 2 hours to get it to work properly.",-1,1,17,0.568569,0.155053
1377,1,14,"it is clumsy and sometimes hangs during synchronization.",-1,1,17,0.579418,0.097934
1377,1,15,"it took a lot of trials for it to finally recognize my phone.",-1,0,9,0.563562,0.100172
1377,1,16,"i also heard that it is problematic with office 2007  i use office 2003 to synchronize my tasks  calendar and contacts .",-1,0,12,0.565700,0.095158
1377,1,17,"i had a similar experience with an earlier motorola phone and it was the exact same software a couple years ago.besides that  i think it is a great phone  the camera pictures are sharp.",-1,0,0,0.571670,0.155053
1377,1,18,"i didn t work on the video and card reading capabilities yet  but other reviewers suggested they work mostly fine.",-1,0,6,0.679251,0.221309
1377,1,19,"i also purchased a 2gb microsd card from amazon  around  25  a great bargain   which also comes with a standard sd adapter  and it allows me to store hundreds of songs and pictures on the phone.",-1,0,11,0.591543,0.212582
1377,1,20,"all in all  a great price for a phone without a contract  and i very highly recommend it.",-1,0,0,0.463393,0.083981
1378,1,0,"motorola ming a1200.",-1,0,7,1.000000,1.000000
1378,1,1,"good phone  as expected.",-1,0,7,0.562968,0.158366
1378,1,2,"strange thing about accessories it is that headphone jack does not fit into phone socket  it is simply larger and for a different model.",-1,1,22,0.561348,0.152979
1379,1,0,"seller trought order instant.",-1,1,25,1.000000,1.000000
1379,1,1,"i order the phone and i did received exactly what they mention but once i charged and tried to use it one part of the ear speaker fall off then i couldn t receive any calls  i tried from a diferent phones to call the motorola ming and just never went trought  does it make calls but not received  i filed the required form to get refound and i end up paying 12.35 for the mail to send the defective phone back to the seller  so if i add the 5.02 i paid for shipping i end up paying 17.35 just for nothing",-1,1,17,0.353979,0.080014
1385,1,0,"cool phone.",-1,0,0,1.000000,1.000000
1385,1,1,"this phone was a gift for my daughter and she loves it.",-1,0,0,0.549759,0.158366
1385,1,2,"she thinks it s cool and easy to use.",-1,0,0,0.564518,0.162655
1385,1,3,"she enjoys it very much.",-1,0,3,0.579164,0.101615
1386,1,0,"stylish and functional.",-1,0,0,1.000000,1.000000
1386,1,1,"this phone is pretty awesome  especially considering the low price for a touchscreen phone.",-1,0,1,0.541303,0.162655
1386,1,2,"the touch screen is nice and has a stylus that comes with.",-1,0,1,0.562192,0.100172
1386,1,3,"i usually use my finger unless i m typing a text message.",-1,0,6,0.557151,0.162655
1386,1,4,"very beautiful phone and interface.",-1,0,10,0.570698,0.100172
1386,1,5,"would recommend to all.",-1,0,0,0.574937,0.162655
1386,1,6,"the plug for the charger is a mini usb so it s compatible with many plugs.",-1,1,16,0.663689,0.225659
1386,1,7,"the box comes with a usb cord  charger  european plug adapter  stereo headphones with a mic  and two software cd s.",-1,1,16,0.135880,0.055236
1391,1,0,"nice phone.",-1,0,1,1.000000,1.000000
1391,1,1,"i bought this phone for my son and he loves it.",-1,0,0,0.550539,0.103078
1391,1,2,"the features are great.",-1,0,0,0.574296,0.101615
1398,1,0,"motorola a1200.",-1,0,7,1.000000,1.000000
1398,1,1,"works well  nice applications format.",-1,0,8,0.554690,0.162655
1398,1,2,"battery life is good.the only defect it has it is dificult to open  but overall its an excellent phone.",-1,0,8,0.565242,0.101615
1401,1,0,"wrong phone.",-1,0,7,1.000000,1.000000
1401,1,1,"ordered the motorola ming a1200 as advertised and received the motorola v3.",-1,0,7,0.541619,0.150928
1401,1,2,"emailed the company and never got a response.",-1,0,6,0.564294,0.101852
1401,1,3,"the receipt calls it both.",-1,1,17,0.570330,0.098977
1401,1,4,"the company seems to have a mix up in what phone they are advertising and what is being delivered.",-1,1,17,0.560757,0.100172
1401,1,5,"the v3 works fine but that is what i was replacing so now i have two of the same phones.",-1,1,17,0.567687,0.103078
1401,1,6,"a bit pointless and a waste of money",-1,1,22,0.576642,0.152979
1402,1,0,"mortorola a1200.",-1,0,7,1.000000,1.000000
1402,1,1,"this is my best phone yet    it s sleek  lightweight has all the features you could need  like memory card  playlist for your tunes etc...",-1,0,9,0.546016,0.162655
1402,1,2,"it connects to the net  email  the whole works  everything a blackberry can do and more.",-1,0,12,0.566993,0.155053
1402,1,3,"really soft on the eyes not bulky at all  all my friends are in love with it   so am i  ",-1,0,0,0.579164,0.152979
1404,1,0,"this is the worst phone i have ever used.short battery liferandomly scrolls through menus in cold weathersends random blank text message to itself after voice mail is checkedrandomly turns offwhen it is turned back on  all ringtones resetno backup keys for when the screen goes bad   and it does go bad.  the display on the screen randomly moves over or down rendering half of the display unusable.keyboard too small to use while moving.poor sound quality   a lot of background noisedoes not hold a signal   literally signal goes to 1 bar whith active line  hang up and watch the signal go to full bars instantly...notification for voice mail does not go away after messages are checked   needs to be cleared manually.first i thought it was just a lemon  so i returned it and got another...",-1,1,17,1.000000,1.000000
1404,1,1,"the second phone produced the same results.",-1,1,17,0.568123,0.162655
1404,1,2,"i m throwing mine in the hudson.",-1,0,6,0.564518,0.100172
1404,1,3,"i recommend a motoming tea party ",-1,0,0,0.566841,0.160499
1405,1,0,"excellent phone.",-1,0,7,1.000000,1.000000
1405,1,1,"everything about this phone is excellent since i had it i never had a problem with it.",-1,0,7,0.044038,0.051884
1405,1,2,"it s easy to use the sound is excellent and the touch screen is perfect one tap and it open s the link that you want when other touch screen phone s you have to tap a couple of times for it to open.",-1,0,7,0.292817,0.096369
1405,1,3,"i don t need to talk about the look of the phone yall can see that for your self.",-1,0,6,0.584270,0.152979
1407,1,0,"cool phone.",-1,0,0,1.000000,1.000000
1407,1,1,"i bought this for my teenage son.",-1,0,0,0.552615,0.100172
1407,1,2,"he loves it and it seems to have a ton of cool features and capabilities.",-1,0,0,0.562765,0.160499
1411,1,0,"wonderful.",-1,0,5,1.000000,1.000000
1411,1,1,"bought this phone for my 15 year old ",-1,0,5,0.550539,0.103078
1411,1,2,"she absolutley loved it  loves everything it will do ",-1,0,5,0.574296,0.160499
1413,1,0,"save your money.",-1,1,22,1.000000,1.000000
1413,1,1,"doesn t work with isync.",-1,1,18,0.661665,0.147057
1413,1,2,"doesn t work with osx bluetooth file transfer.",-1,1,18,0.096669,0.037324
1413,1,3,"sad.hours wasted trying to make it work.",-1,1,22,0.213318,0.080731
1413,1,4,"save your money.",-1,1,22,0.578806,0.160499
1415,1,0,"warnings  can t return it to merchant  and unsupported in the u.s.  but..",-1,1,25,1.000000,1.000000
1415,1,1,"i recieved this phone as a christmas gift  and have two warnings   the merchant will not accept returns  and motorola customer service says this phone is not usable by any carrier in the u.s.",-1,1,25,0.157282,0.045763
1415,1,2,"however  i was able to find a local phone store which sucessfully programmed the internet access through t mobile zones.",-1,1,14,0.663638,0.143940
1415,1,3,"this was not a  no brainer   the phone software is loaded with a dozen or so european service providers  and you ll need to know and add to the phone the ip addresses to access your phone company s servers.on the plus side  this phone s screen is a true stunner  it s bright and crisp  and nicely displays a web page in either horizontal or vertical orientation.",-1,1,21,0.460354,0.146376
1415,1,4,"should the built in software leave you wanting more  there seems to be hundreds of free java phone applications available for this phone on motorola fan websites.",-1,1,18,0.479801,0.144398
1416,1,0,"the best.",-1,1,23,1.000000,1.000000
1416,1,1,"good the product is surprising  really single that good for the people whom it likes to go to celebrations they have to have you take care of since he is very delicatefor that reason i give 5 stars him",-1,1,23,0.553344,0.101615
1417,1,0,"we write to officially inform amazon of the ordill we have been through since the purchase was made.",-1,0,4,1.000000,1.000000
1417,1,1,"our item was to be shipped to dhl registered office  united shipping parkaging.",-1,0,9,0.546717,0.103078
1417,1,2,"200 e 10th st.",-1,0,9,0.666581,0.147057
1417,1,3,"new york  ny 10003 united states.",-1,0,9,0.044773,0.027581
1417,1,4,"we got a ups alert that our product has been delivered to new york without stating where in new york.",-1,1,24,0.570698,0.097934
1417,1,5,"we contacted dhl our official courier company to ascertain these claim.",-1,1,24,0.562584,0.100172
1417,1,6,"dhl have confirm not recieving the item though ups claims it was signed for by clavera whose identity we don t know.as we write these review  we don t know the where about of our item.",-1,1,24,0.667426,0.143940
1417,1,7,"we have contacted etronics several times to send a copy of the delivery or any document that was used to make the delivery but up till now we have got nothing from etronics other than their claim that the item has been delivered.we hope you act on our behalf.oursendurancelins consult ltd",-1,1,19,0.236817,0.063738
1418,1,0,"great rugged phone.",-1,0,1,1.000000,1.000000
1418,1,1,"this phone is a great phone....",-1,0,1,0.013981,0.020485
1418,1,2,"if your looking for other features.... don t bother.",-1,0,1,0.546899,0.155053
1418,1,3,"can t do picture mail  can t do video msging  can t do a lot of things.",-1,1,23,0.548512,0.103078
1418,1,4,"well why the five star review ",-1,1,23,0.566269,0.097934
1418,1,5,"because what it does  it does extremely well.",-1,1,23,0.567867,0.100172
1418,1,6,"i ve had it on and used it daily for a week now and i m only down to half battery.... thats incredible.",-1,1,13,0.554588,0.103078
1418,1,7,"no problem.",-1,1,13,0.676766,0.215872
1418,1,8,"no problem.",-1,1,13,0.015140,0.020485
1418,1,9,"this phone is great for day to day if all you need  or want  is a phone that just works.i called the company only once and they were very helpful  they are sending me   for free  a piece i lost.",-1,1,13,0.662837,0.221309
1418,1,10,"just can t beat that kind of service.best featureit can record phone calls ",-1,1,19,0.574408,0.130373
1418,1,11,"very usefulpros battery life is better than almost anythingrugged and waterprooftheir warranty is the best in the business and they stand behind itconssoftware is just bad... some things you would think would be easy are either missing completely or just not usablescreen is not scratch proof.. don t key it",-1,1,20,0.449739,0.141063
1419,1,0,"we had a richochet at the range  .40",-1,0,12,1.000000,1.000000
1419,1,1,"we picked up the phone  it was still on.",-1,0,12,0.551705,0.103078
1419,1,2,"sent it in and got a new one in about a week.",-1,0,12,0.555984,0.100172
1419,1,3,"they did call out of curiousity wanting to know what happened  the response was  oh  ok  new one s on the way. ",-1,0,12,0.554042,0.095158
1419,1,4,"and those of you who are just looking for a tough phone with a bunch of apps  cause you dropped yours in the toilet go buy a casio g zone  this isn t a smart phone  it doesn t have android or whatever on it  it s a phone  for people who actually work hard for a living  not for some whiney  coffee drinking hipster sitting in an internet cafe  with delusions of grandeur.",-1,0,12,0.554865,0.097934
1419,1,5,"this company is the only one who designed a phone for a lone worker in remote locations with a  man down  feature  that means the phone calls for help if you get incapacitated  it dials on it s own.",-1,1,24,0.571514,0.095158
1419,1,6,"do you really think they care about your facebook account ",-1,1,23,0.580040,0.103078
1419,1,7,"it s a phone for actually communicating with someone  deal with it.",-1,1,23,0.585418,0.101615
1421,1,0,"sonim xp3 quest black.",-1,1,24,1.000000,1.000000
1421,1,1,"i ve had various  tough  phones from nextel and the lastest from samsun  a657  all meet a timely dimise eventually.",-1,1,24,0.544991,0.097934
1421,1,2,"thats why i got this  the warranty.",-1,1,13,0.662354,0.147057
1421,1,3,"and used it just the 2nd day i had it to more or less test the abuse and warranty.",-1,1,13,0.072321,0.034041
1421,1,4,"warranty is awesome  about a week turn around from destruction to replacement.the call quality is pretty good  at t   the speaker gets a bit muffled if you dunk it then make a call but otherwise the ringer is loud    vibrate is worthless.",-1,1,13,0.306763,0.094482
1421,1,5,"battery life is about 6 or 7 days for me  texting all day and constant flashlight useage .",-1,1,13,0.570211,0.158366
1421,1,6,"i don t have the net so can t comment on it but for use as a phone and camera it works great.the software that comes with it is worthless  just plug it in and use it as a usb storage device to transfer your photos.",-1,1,21,0.669332,0.221309
1421,1,7,"it also has no built in photo editing options.hands down the most durable phone i have ever had and when the 3 years is up  i will trash it to get a new one  then when it dies out of warranty i will buy another     i ll never buy a regular phone again.did i mention it s water proof    ever get a call while you are in the shower ",-1,1,19,0.389631,0.101433
1421,1,8,"it s the easiest way to clean grit and grease off too i use my hand nail brush to scrub it clean once a week while i m in there.",-1,1,19,0.587666,0.100405
1423,1,0,"sonim xforce 3300.",-1,1,24,1.000000,1.000000
1423,1,1,"worst customer service ever.",-1,1,24,0.540196,0.162655
1423,1,2,"sub standard product across the board.",-1,1,24,0.557928,0.158366
1423,1,3,"do not buy this phone  do not deal with this company.",-1,1,22,0.542416,0.103078
1423,1,4,"here is my story so far...   i am a military operator and have dealt with one issue or other with this phone for 9 straight months.",-1,1,22,0.546855,0.103078
1423,1,5,"i ordered this phone for an upcoming deployment.",-1,1,25,0.562885,0.095158
1423,1,6,"i received the phone and the battery cover would not seat properly.",-1,1,14,0.647227,0.143940
1423,1,7,"i notified sonim and  after a series of trouble shooting inspections  they agreed to mail out a new cover.",-1,1,17,0.377140,0.169471
1423,1,8,"i received the new cover and the cover will still not seat properly.",-1,1,17,0.107740,0.065495
1423,1,9,"sonim had me mail in the phone to their repair shop.",-1,1,25,0.563567,0.100172
1423,1,10,"there is no replacement phone and no other plan  they have you send the phone in for days weeks  or  in my case  months due to the return shipment from sonim  getting lost .",-1,1,17,0.549577,0.103078
1423,1,11,"the phone finally gets to me and i find that  again  the cover will not seat properly.",-1,1,17,0.564880,0.097934
1423,1,12,"in addition to this  i learned that the phone will not read an sd card.",-1,1,21,0.659573,0.147057
1423,1,13,"no sd card would work  8gb sandisk  16gb sandisk  32gb sandisk.",-1,1,21,0.159862,0.042752
1423,1,14,"i again contacted sonim  this time i dealt with  lorenzo  who was unprofessional  combative  and a complete waste of time.",-1,1,24,0.564933,0.158366
1423,1,15,"instead of addressing my issues  he chose to play investigator and challenge every prior issue i had  which i could prove via back and forth emails with sonim over my whole deployment .",-1,1,23,0.664826,0.231270
1423,1,16,"instead of resourcing sonim s own company records  he chose to solicit my emails from me and then cross examine me on them.",-1,1,23,0.457610,0.116368
1423,1,17,"as if i would randomly create a mile long chain of emails with my secret accomplice that works for sonim.",-1,1,23,0.207942,0.049391
1423,1,18,"after dealing with that guy  i requested a full refund based on the pattern of defects  their frequency  and the substandard customer service.",-1,1,22,0.561957,0.095158
1423,1,19,"my request was rejected due to the amount of time elapsed since i bought the phone.",-1,1,22,0.675142,0.143940
1423,1,20,"i bought the phone in september of 2012 and i am writing this review on may 2013.",-1,1,24,0.259693,0.053639
1423,1,21,"in all that time  i can count on two hands the number of times i have actually gotten to use this phone.",-1,1,24,0.573018,0.103078
1423,1,22,"nearly the entire past 9 months has been consumed with shipping the phone back and forth to the repair shop.",-1,1,24,0.569178,0.100172
1423,1,23,"tomorrow morning  i will put it in the mail again for the sd card defect and the battery cover defect.",-1,1,13,0.669570,0.151095
1423,1,24,"this marks the fourth time i have had to deal with the battery cover defect alone.",-1,1,13,0.074549,0.031497
1423,1,25,"by all reckoning  you could still consider the phone brand new.",-1,1,22,0.582294,0.097934
1423,1,26,"you cannot trust the product in the field or on deployment.",-1,1,24,0.582156,0.104169
1423,1,27,"you cannot trust the customer service methods and practices to consider your interests.",-1,1,24,0.568894,0.095158
1423,1,28,"do not buy this phone and do not deal with this company.",-1,1,22,0.578200,0.101852
1423,1,29,"having a 3 year warranty is no excuse for having your customers spend that 3 years mailing the phone back and forth to the repair shop.",-1,1,13,0.671256,0.147057
1423,1,30,"here is an excerpt from july 2012 that i found on a website yesterday regarding customers who have bought this phone   many of you who sent their phones in for service ended up having them fail multiple times and had the inconvenience and possibly cost of having to send them someplace to get serviced again and again...   http   www.sonimquest.com 2012 07 01 archive.html",-1,1,13,0.350949,0.074384
1425,1,0,"can you hear me now ",-1,1,17,1.000000,1.000000
1425,1,1,"callers requested i text them because they couldn t understand me during voice conversations.",-1,1,17,0.544923,0.097934
1425,1,2,"also  reception was lacking even in highly populated areas.",-1,1,17,0.561109,0.103078
1425,1,3,"i grew so aggravated with the phone that i spiked it like a football and it no longer works.",-1,1,17,0.574090,0.095158
1425,1,4,"don t bother with this product unless you are just going to use it as a radio.",-1,1,18,0.570599,0.101615
1426,1,0,"sonim phone problems.",-1,1,17,1.000000,1.000000
1426,1,1,"phone was shipped fast but when it arrived it had a constant humming sound when making calls.",-1,1,24,0.648055,0.221309
1426,1,2,"tried several sim cards and no matter what it still made the same background noise when making a call.",-1,1,17,0.489925,0.124396
1426,1,3,"both the person making the call and the phone that was called could hear the baground noise .",-1,1,17,0.237328,0.067219
1430,1,0,"ripoff   pain in the a   this phone started off as really interesting for me.",-1,1,22,1.000000,1.000000
1430,1,1,"however it is slow.",-1,1,15,0.555662,0.100172
1430,1,2,"i found out that the longer it s on  the slower it gets.",-1,1,15,0.551453,0.100172
1430,1,3,"it also sometimes crashes too.these were the things that initially interested me  it had a nice slide out keyboard and a touchscreen  good camera for the price and it could function as a really good ipod replacement ",-1,1,15,0.542031,0.155053
1430,1,4,"sadly though  i found out that  out of the box  its calendar does not work  nor does gmail or any other google application.",-1,1,23,0.662759,0.221309
1430,1,5,"that s right   it s an android phone that can t use the android market.....this is because none of those applications are set up to sync with google over wi fi.",-1,1,23,0.222738,0.047046
1430,1,6,"somehow you need to activate a data service plan with a contract  and funnily enough  t mobile wouldn t support it with a 3g signal   ie. this phone can t use 3g.",-1,0,2,0.557018,0.103078
1430,1,7," maybe if you live where there s a rogers network it works better.",-1,0,2,0.568936,0.100172
1430,1,8,"but certainly not for t mobile usa. even if you choose to root it and install openetna  it s still a pain in the a  .",-1,0,4,0.561037,0.097934
1430,1,9,"i could finally use the market  sure  but then my camera was like on auto fire  browsing on wi fi was unbearably slow  and adding contacts made people awkwardly wait with me while i cursed and pressed hard on the resistive touchscreen.and if you give this to someone else they will be confused when they accidentally press the back or home key.",-1,0,10,0.558287,0.103078
1430,1,10,"that s right   they aren t buttons  they are  soft keys   meaning you can t hold the phone  you let it rest in your palm.",-1,1,16,0.677281,0.151095
1430,1,11,"oh  and what if you press the back button while picking up your phone ",-1,1,16,0.140662,0.041615
1430,1,12,"end of call.",-1,1,16,0.579720,0.100172
1430,1,13,"want to find a contact while talking to someone ",-1,1,23,0.565280,0.103078
1430,1,14,"oops  the phone locked itself  don t accidentally hang up want to type a symbol ",-1,1,16,0.575505,0.095158
1430,1,15,"use the orange  fn  key and press space and then choose it from the menu  ...every time...    the phone i got had a set of chinese   korean symbols on them and the symbols on the keys were not the ones that came out on the screen.anyway there are plenty of better phones for 200 bucks and less that will work more easily and quickly for what this phone tries to do.",-1,1,20,0.568014,0.103078
1430,1,16,"if you re searching for an iphone equivalent  don t give up  just don t buy this p.o.s.",-1,1,20,0.588893,0.100405
1432,1,0,"phone failed  international guarantee is not covered by lg.",-1,1,19,1.000000,1.000000
1432,1,1,"i bought this phone for use in peru  i choosed it because the seller ofered international guarantee.the phone makes an impressive interference about 4 ft from any computer speakers  also about 1 month after i bought it appeared some lines on the screen  looking into online reviews i found that is a factory failure.i talked to the service representative in my country and they told me that the guarantee for this phone is only local.",-1,1,19,0.554835,0.200766
1432,1,2,"when i contacted the seller they told me that i need to contact lg directly and may be talking to a company representing lg.i called lg directly and they told me that the guarantee doesnt work outside of the original country  so they just lied to me.",-1,1,19,0.385319,0.131491
1464,1,0,"worst of     de lo peor.",-1,1,18,1.000000,1.000000
1464,1,1,"a total disappointment  team comes in chinese and english only  not as described in spanish  the worst is that no longer than android google has installed and play apk download it as not permitted to run the app or any other of google inc.una total decepci n  el equipo viene solo en chino e ingles  no en espa ol como describe  lo peor es que no tiene android ya que no tiene instalado google play y al bajarlo como apk no permite ejecutar la app ni ninguna otra de google inc.",-1,1,18,0.393281,0.084936
1475,1,0,"worst phone ever.",-1,0,8,1.000000,1.000000
1475,1,1,"i cant believe this is a google phone.",-1,0,8,0.653656,0.225659
1475,1,2,"seriously  it is not google quality.",-1,0,8,0.071550,0.035103
1475,1,3,"i wasted my money on this crap cellphone.",-1,1,22,0.661456,0.225659
1475,1,4,"dont waste your money.",-1,1,22,0.031011,0.026669
1475,1,5,"believe me  don t waste your money  buy something else.its impossible to search within my email  i must have two separate email windows  one for gmail and other for other type emails   it calls people when locked on my pocket  the device is too big to fit on my hand  the camera sucks   many other s   ty features.its",-1,1,23,0.221816,0.053072
1475,1,6,"just not what i was expecting from google.its",-1,1,23,0.584225,0.162655
1475,1,7,"sad and of course  im screwed with this crapy phone and no one is going to reimburse my money.i cant believe it.",-1,1,23,0.577246,0.101615
1476,1,0,"do not buy this phone.",-1,1,20,1.000000,1.000000
1476,1,1,"i strongly do not recommend buying this phone and here are list of reasons 1.",-1,1,20,0.111584,0.063859
1476,1,2,"i checked and it is not shockproof.",-1,1,20,0.560007,0.150928
1476,1,3,"i bought some 4 weeks ago and received 2 weeks ago this phone  so i have 2 week experience working with it.",-1,1,25,0.642826,0.151095
1476,1,4,"first day it was working.",-1,1,13,0.530520,0.126853
1476,1,5,"in the evening i gave it to my children for playing and next day in the morning i called and it hang up itself  but i was able to send sms.",-1,1,13,0.180143,0.046389
1476,1,6,"after i just moved sim card to another slot  it started working.",-1,1,14,0.655072,0.147057
1476,1,7,"it worked for 2 days and stopped working right after i dropped it from about 1 meter on the floor.",-1,1,13,0.307242,0.074876
1476,1,8,"i again moved sim card to another slot and it started working.",-1,1,18,0.406097,0.114578
1476,1,9,"after that every time i was dropping it  it was stopping working  but moving sim card to another slot was always helping.",-1,1,18,0.042676,0.028644
