907,2,3,"   not really bad enough to take away an egg.",1,1,8,0.553675,0.223050
908,2,0,"can run 1842x1036  about 1080p  at 60hz and colors are nice",0,0,5,1.000000,1.000000
908,2,1,"my old sharp aquos looks better than this i use this for my pc and it makes maxed out games look really bad",1,1,12,0.562600,0.223050
909,2,0,"picture is not bad if looking pretty straight on",0,1,12,1.000000,1.000000
909,2,1,"sound is very weak.",1,1,12,0.615070,0.241050
909,2,2,"remote controlsdon t work.",1,1,15,0.570922,0.156283
909,2,3,"can only be used manually",1,1,15,0.560644,0.142275
910,2,0,"good price.",0,0,6,1.000000,1.000000
910,2,1,"picture ok.",0,0,6,0.627670,0.202993
910,2,2,"lots of inputs",0,0,7,0.562548,0.129329
910,2,3,"the remote was doa.",1,0,7,0.579256,0.155057
910,2,4,"just no output.",1,0,7,0.533383,0.142275
911,2,0,"great picture  great sound  easy to set up...excellent price.",0,0,6,1.000000,1.000000
911,2,1,"none....for the price it was more than i expected.",1,0,6,0.425859,0.201320
912,2,0,"nice picture when hooked up to hdmi",0,0,7,1.000000,1.000000
912,2,1,"dvd cd player doesn t work.",1,0,7,0.621735,0.202993
912,2,2,"sent to daughter at college who decided she didn t have room really...  just got it back 5 days out of warranty.",1,0,4,0.545855,0.129329
912,2,3,"dvd cd doesn t work  never was used.",1,0,7,0.573126,0.163648
913,2,0,"worked perfectly right out of the box  ordered one day and got it the next.",0,0,1,1.000000,1.000000
913,2,1,"newegg  as usual  made ordering online a breeze.",0,0,4,0.324808,0.164797
913,2,2,"great price and service.",0,0,1,0.550139,0.223050
914,2,0,"1 year constant use no issues 2 hdmi inputs  i can use hdmi hub if i need more   40 inch 1080p    10 an inch  rated 8ms or less  average lcd monitor speed ",0,0,3,1.000000,1.000000
914,2,1,"box had another label on it  like it was supposed to have been shipped to some doctor s office or similar business.",1,1,13,0.728892,0.171967
914,2,2,"box had a few dents  and tape was nearly opened fully.",1,1,13,0.241547,0.121637
914,2,3,"i was about to refuse shipment  but after inspection all parts where there  no added tape on box  and no physical damage to the tv.",1,1,13,0.176792,0.089357
914,2,4,"so i decided to keep it.",1,1,13,0.608113,0.129329
914,2,5,"i assume it must of been a refusal of delivery from a previous order  or a canceled order.",1,1,13,0.548757,0.128282
914,2,6,"as far as non newegg related cons  i have none.",1,1,13,0.579103,0.156283
914,2,7,"i heard horror stories about this product while doing research and i was scared.",1,1,13,0.574762,0.128282
914,2,8,"glad i did not have similar issues.",1,1,8,0.542534,0.242761
914,2,9,"so a con could be it did not live up to those expectations    ha ha ha.",1,1,8,0.502887,0.204507
914,2,10,"newegg does not have anymore in stock.",1,1,14,0.547723,0.142275
915,2,0,"very easy to set up  we got this for my husband for his birthday and the children  8 12   14  set it up for him.",0,0,1,1.000000,1.000000
915,2,1,"we played with the picture a bit to match our space and inputs  but we had an  old fashioned  tv before and this is amazing colors.",0,0,0,0.607827,0.241050
915,2,2,"looks like we are at the movie theater.",0,0,0,0.624122,0.202993
915,2,3,"we like the sleek look.",0,0,0,0.600251,0.128282
915,2,4,"we did not use the speakers since we already had a decent surround sound.",0,0,0,0.530550,0.155057
915,2,5,"the only thing i worry about is the light weight  so we are getting a wall mount since we are worried that the kids might knock it off the desk that it sits on.",1,0,0,0.615060,0.171967
915,2,6,"also don t sit really close or the picture looks weird  from the couch it is amazingly great  if you have a small room it may be too big.",1,0,0,0.398821,0.207881
916,2,0,"nice picture when it worked.",0,0,6,1.000000,1.000000
916,2,1," worked for about six weeks.",1,1,11,0.235358,0.125610
916,2,2," toshiba warranty service was a joke  it took a long time to get it replaced.",1,1,11,0.629933,0.205708
916,2,3,"bought 12 06  went out around 01 17  claim filed shortly thereafter  replaced with a refurbished unit with a dead pixel and scratched stand on 04 08.",1,0,4,0.431629,0.133869
917,2,0,"great newegg pricing ",0,0,1,1.000000,1.000000
917,2,1,"looking for basic 40 inch tv to replace old 27 inch model and this fit the bill.",0,0,1,0.544804,0.221437
918,2,0,"great picture  couldn t beat price for 40  1080p   388 .",0,0,2,1.000000,1.000000
918,2,1,"sound is a little tinny on the standard speakers.",1,1,12,0.594464,0.221437
919,2,0,"decent tv for the price.",0,0,6,1.000000,1.000000
919,2,1,"only 2 hdmi ports.",1,1,9,0.674587,0.205708
919,2,2,"about once an hour  sometimes more  with comcast  the sound cuts out for about 3 seconds.",1,1,9,0.274355,0.081711
919,2,3,"i m not sure where the problem is  but it never happened before with the same box  same cable on my old tv.",1,1,9,0.568897,0.276262
919,2,4,"hard to get the right setting for contrast.",1,1,15,0.547412,0.254746
920,2,0,"nice little basic hd tv...cheap price...all around not bad",0,0,2,1.000000,1.000000
920,2,1,"ok...you shell out about  400 after all is said and done.open the box.start setting up and then...boom...where is the hdmi cable  ask the kids what they did with it...wife where is the cable..did you see it  ",1,1,9,0.658010,0.170642
920,2,2,"you have to go out and buy a cable..it does not come with the tv wouldn t you think it would come with the unit  why is this done  now i have a bad taste in my mouth when i think of toshiba..bad move toshiba...is it that important to squeeze a miniscule amount of profit from us buyers...very bad move",1,1,12,0.405081,0.204417
921,2,0,"good picture  dynabright is really nice.",0,0,6,1.000000,1.000000
921,2,1,"stopped working after about 7 months of less than average use.",1,1,9,0.662761,0.307512
921,2,2,"when power button is pressed  the green led turns on for 10 seconds  then turns off with the screen never turning on.",1,1,11,0.426003,0.153937
922,2,0,"great price  got for under  200 at black friday.",0,0,1,1.000000,1.000000
922,2,1,"once you go into the preferences and get rid of the energy saving picture mode  the picture is pretty good for a 60hz.",0,0,3,0.602971,0.156283
922,2,2,"i haven t had a problem with the sound at all  i think it s better than average.",0,0,4,0.634406,0.204507
922,2,3,"sturdy  doesn t feel like it will break.",0,0,4,0.635843,0.241050
922,2,4,"has vga hook up.",0,1,9,0.576732,0.129329
922,2,5,"there are only 2 hdmi ports...which is sufficient.",1,1,9,0.656886,0.171967
922,2,6,"but don t get me started on how pointless and false advertising the usb port is that is on the set.",1,1,14,0.445329,0.182247
922,2,7,"i quote has  usb media port  but the specs don t go into detail saying what it can and cannot play.",1,0,7,0.222273,0.092014
922,2,8,"i get this bad boy home  plug in my usb  and to my surprise it will only  show  jpeg files and  play  mp3s....that s it.",1,0,7,0.238820,0.183600
922,2,9,"i have home movies and other media items that i would love to watch and have watched on my vizio as long as they are avi files  which isn t an issue at all.",1,1,10,0.528254,0.294412
922,2,10,"for the sticker price of this guy  i would expect that it could play avi files  i m very very upset that it can t do it.",1,1,9,0.371779,0.144144
922,2,11,"it also lacks a quam tuner so if you don t have cable or satellite  then make sure you get it a tv tuner to watch your local stations.",1,1,9,0.528150,0.204507
922,2,12,"the remote sensor is in the bottom left corner and it makes it difficult to respond if you are a few degrees off from it   aka don t point at the center of the tv.",1,1,11,0.611303,0.204188
922,2,13,"the remote is also a little slow to respond compared to other tvs but it s not a deal breaker.",1,1,14,0.381298,0.128749
923,2,0,"i guess since i m so familiar with good color quality  being a cgi designer   i probably should ve followed my first thought   not purchased this tv.",0,1,13,1.000000,1.000000
923,2,1,"but because it was the midnight madness black friday sale at the local best b y  and this tv was only 179 bucks  i figured i d give it a shot.",0,1,8,0.624036,0.129329
923,2,2,"sheesh... so many to mention  but let s start with color.",1,0,5,0.625037,0.241050
923,2,3,"terrible.",1,0,1,0.618450,0.223050
923,2,4,"and when you try to adjust it  your options are washed out or over saturated.",1,0,6,0.557003,0.204507
923,2,5,"also  the picture is dark and the contrast setting comes pre set at 100  so you can t make it any brighter.",1,0,6,0.623353,0.205708
923,2,6,"adjusting the actual  brightness  setting just gives it a washed out coloring.",1,0,6,0.304841,0.103334
923,2,7,"the picture is also  cloudy  looking and no matter how high you adjust the sharpness  it doesn t clear things up at all.",1,0,6,0.287206,0.104389
923,2,8,"and i m really surprised that regardless of the numerous adjustment settings  none of them help anything... lol  it s almost as if they put them there just to fool people who may be looking at the tv in the store.",1,0,4,0.391364,0.129790
924,2,0,"great tv for the price  bought mine for  384.99 .",0,0,4,1.000000,1.000000
924,2,1,"bought it as a gift for my mother.",0,0,4,0.243134,0.124153
924,2,2,"it does what i would expect a tv to do.",0,0,1,0.613220,0.155057
924,2,3,"i like my 40  panasonic better.",0,0,5,0.658573,0.170642
924,2,4,"number 1 complaint  the audio is too low.",1,1,14,0.460492,0.234560
924,2,5,"even when the volume is cranked up all of the way  the audio is too low ",1,1,15,0.170899,0.119842
924,2,6,"the chipset for this tv must be cheap because its response time to the remote control is horrendous.",1,1,15,0.642285,0.204188
924,2,7,"in other words  it takes too long for the tv to respond to a button press on the control.",1,1,15,0.484142,0.154226
924,2,8,"so sometimes you press the button more than once thinking the tv didn t receive the signal  but it did and now you are two channels ahead of where you wanted to be.",1,1,15,0.171128,0.092670
924,2,9,"the remote control distance is very short.",1,1,15,0.571979,0.156283
924,2,10,"i d say about 4 5 feet at best.",1,1,10,0.523188,0.204507
924,2,11,"i think it wouldn t have hurt to still include one dedicated composite input.",1,1,12,0.527563,0.241050
924,2,12,"i know it is old  but there are still a lot of devices that use it.",1,1,12,0.531933,0.142275
925,2,0,"the tv has been great.",0,0,1,1.000000,1.000000
925,2,1,"we ve had no issue with the quality of the picture nor it s feature set.",0,0,1,0.568716,0.202993
925,2,2,"all the plugs available are great as well as i run an hdmi cable from my computer to it as well.",0,0,0,0.570922,0.202993
925,2,3,"it is fairly slow turning on  but that is a minor inconvenience in the grand scheme of things.",1,1,15,0.539677,0.221437
926,2,0,"great tv  pretty inexpensive.",0,0,4,1.000000,1.000000
926,2,1,"got it for my first college house  and love it.",0,0,4,0.601612,0.156283
926,2,2,"the base of the tv is very large  it hangs off the ends of my tv stand.",1,1,8,0.570922,0.204507
926,2,3,"not a big deal but just a thing to know",1,1,15,0.525616,0.141140
927,2,0,"amazing picture quality and brightness.",0,0,6,1.000000,1.000000
927,2,1,"can t stress enough how good it looks.",0,0,6,0.721229,0.204188
927,2,2,"good   of usb video ports unbeatable price   350 nov  14  menus are easy to navigate included remote works great  have had it for a few months now  no complaints  often gets remarked by people coming over to watch movies.",0,0,4,0.304646,0.103887
927,2,3,"disable most of the extraneous features and do some minor color calibration if you are picky.",0,0,1,0.619744,0.204507
927,2,4,"the 120hz mode looks great for sports and gaming.",0,0,3,0.554243,0.202993
927,2,5,"stand is very basic.",1,1,13,0.580301,0.241050
927,2,6,"software is actively bad and slow.",1,1,10,0.525616,0.204507
927,2,7,"processing for 120hz mode can sometimes lead to blur depending on source.",1,1,15,0.506992,0.221437
928,2,0,"colors  price  decent wifi to stream from pc.  tv is fantastic  streams about any file type from the computers with the custom profile mezzmo created for me.",0,0,7,1.000000,1.000000
928,2,1,"newegg rolled over on me again and denied the rebate",1,1,14,0.608487,0.223050
929,2,0,"amazingly sharp picture quality strong ota hd channels reception  smart tv function 120 hz refresh rate native audio return channel   arc support auto firmware update.",0,0,7,1.000000,1.000000
929,2,1,"wifi lan support dlna support  great sound",0,0,7,0.415146,0.086463
929,2,2,"90 days warranty only due to refurbished unit.",1,1,11,0.583244,0.242761
929,2,3,"limited apps.",1,1,10,0.595631,0.156283
929,2,4,"no biggie if you had roku unit.",1,1,11,0.571008,0.156283
929,2,5,"no picture in picture function",1,1,15,0.500969,0.142275
930,2,0,"man  i bought samsung led smart tv from somewhere else and this one from newegg for my room and the guest room.",0,0,4,1.000000,1.000000
930,2,1,"i think hisense is pulling a lot faster and smoother.",0,0,7,0.645572,0.128282
930,2,2,"both were 120hz but somehow samsung one had lag which i was very surprised.",0,0,4,0.560427,0.156283
930,2,3,"i highly recommend this product i am happy with my first newegg purchase as well and will be placing more orders often now.",0,0,4,0.553046,0.241050
930,2,4,"none actually power button won t shut down at first but now is working fine and it tries to update but cant.",1,1,11,0.639556,0.309503
930,2,5,"but everything i care is just netflix and connection with my pc which is perfectly fine so no cons for me",1,1,13,0.401715,0.207881
931,2,0,"best tv for the price.. came to my house in perfect condition.",0,0,5,1.000000,1.000000
931,2,1,"i cant even tell its been refurbished",0,0,4,0.603767,0.223050
932,2,0,"vivid colors  fast response times  excellent built quality  aesthetically pleasing  etc.",0,0,0,1.000000,1.000000
932,2,1,"for the price of  350  you cannot go wrong with this purchase.",0,0,4,0.639305,0.232693
932,2,2,"while i have only had the unit for a few days  i have tested it out pretty thoroughly.",0,0,4,0.587039,0.274400
932,2,3,"the smart features are robust enough  usb input works well  wifi is great.",0,0,7,0.645003,0.309503
932,2,4,"i ve connected my laptop  xbox  and phone to test qualities and all worked without a hitch.",0,0,3,0.362321,0.143899
932,2,5,"simply put  if you want a surprisingly exceptional tv on the cheap  this is your ticket.",0,0,7,0.565093,0.156283
932,2,6,"minor issue with uneven back lighting  but its not bad  and i have seen worse on more expensive  brand name models.",1,1,14,0.501990,0.221437
933,2,0,"i am happy with this tv.",0,0,4,1.000000,1.000000
933,2,1,"i use the built in netflix and stream video from my laptop pc.",0,0,7,0.594156,0.204507
933,2,2,"the picture seems fine to me.",0,0,7,0.719989,0.171967
933,2,3,"the sound seems fine too.",0,0,7,0.187522,0.090120
933,2,4,"consumer reports gave this model an adequate review.",0,1,10,0.610808,0.129329
933,2,5,"shipping was quick  three days.",0,1,10,0.591992,0.156283
933,2,6,"while attempting to navigate netflix and change picture settings the tv froze up  a couple times.",1,1,15,0.576848,0.129329
933,2,7,"the firmware seems to need more work.",1,1,10,0.623802,0.155057
933,2,8,"also some menu settings are useless.",1,1,15,0.589684,0.150283
933,2,9,"for example the  auto volume level  option just makes things worse.",1,1,9,0.646550,0.235688
933,2,10,"commercials are actually louder when  auto volume level  is switched on.",1,1,9,0.138951,0.070572
933,2,11,"tv is obviously refurbished.",1,1,13,0.600992,0.128282
933,2,12,"the packaging was beat up  even inside the box.",1,1,13,0.540320,0.155057
933,2,13,"but the tv arrived undamaged.",1,1,13,0.590389,0.156283
933,2,14,"the instructions appear to be xerox copies.",1,1,11,0.557392,0.129329
933,2,15,"no batteries included.",1,1,11,0.530920,0.128282
933,2,16,"the hisnese website lists a  merlin  motion sensing remote for this model.",1,1,11,0.610597,0.205708
933,2,17,"however the actual remote is just a basic ir type.",1,1,11,0.257386,0.100721
933,2,18,"no support.",1,1,10,0.646458,0.171967
933,2,19,"i called tech support during business hours.",1,1,10,0.125046,0.090120
933,2,20,"i gave up after a full 20 minutes on hold.",1,1,10,0.524607,0.129329
933,2,21,"i emailed tech support also.",1,1,10,0.540220,0.156283
933,2,22,"i sent the email three days ago  no response yet.",1,1,10,0.492438,0.142275
934,2,0,"it was cheap  329 for a 48  refurbished tv.",0,1,11,1.000000,1.000000
934,2,1,"the tv came with two dead pixels that permanently shine bright white.",1,0,0,0.614539,0.156283
934,2,2,"the smart tv software on this tv is very sluggish and slow to respond to input.",1,0,2,0.607418,0.129329
934,2,3,"the youtube app was poorly designed and is awkward to use.",1,0,3,0.579758,0.242761
934,2,4,"chrome cast works  but the picture is not crisp.",1,0,6,0.645072,0.309503
934,2,5,"the whole picture has a bit of fuzziness to it.",1,0,6,0.195704,0.077304
934,2,6,"i would not recommend this tv to anyone.",1,0,6,0.547242,0.223050
935,2,0,"easy setup great picture everything functions as suppose to.",0,0,2,1.000000,1.000000
935,2,1,"heavy stand makes it secure.",0,1,13,0.615780,0.202993
935,2,2,"don t really have any cons",1,1,13,0.571008,0.142275
936,2,0,"inexpensive  good picture  easy to set up  fast shippingf",0,0,6,1.000000,1.000000
936,2,1,"could use more detailed instructions  particularly for someone who hasn t used a  smart  tv before.",1,1,10,0.625712,0.202993
936,2,2,"when it auto scans for the stations  there are sometimes 2 or more stations with the same number  ie  10 1  10 2  10 3.",1,1,10,0.545855,0.155057
936,2,3,"one is regular broadcast  another hd  but the other is unknown.",1,1,9,0.564814,0.142275
937,2,0," easy to connect to home network  native youtube vudu netflix  used tv speakers for a few minutes not too bad  optical out to connect to receiver when using hdmi 1 for uhd with non uhd receiver  small thin bezel",0,0,0,1.000000,1.000000
937,2,1," stand if not hanging is terrible  limited compatibility of hisense apps to install  lack of 4k content in general  single uhd input  hdmi 1   lack of external controls on bezel  no power button etc ",1,1,9,0.440005,0.131142
938,2,0,"tv shows a great picture for the price.",0,0,6,1.000000,1.000000
938,2,1,"network capability with streaming your movies from a computer to this tv  you tube  3 hdmi ports and other port.",0,0,7,0.591345,0.202993
938,2,2,"i purchased this tv to place in my kitchen to have something to watch while cooking.",1,0,7,0.636003,0.129329
938,2,3,"tv was a great price and cost as much as an under the cabinet tv.",1,0,7,0.577741,0.242761
938,2,4,"i wanted the smart tv function on the tv to be able to stream netflix along with connection it to my hard wired outside antenna that s in my attic of my home.",1,1,10,0.640378,0.264404
938,2,5,"netflix upgraded there app to version 4.0.6 and the tv is stuck on version 4.0.3 and it seems as if the customer service department it guys don t know how to upgrade the netflix app or they don t care to try.",1,1,10,0.329206,0.107523
938,2,6,"the reason i say that is because they have integrated roku systems into there newer line up of tv s.",1,1,10,0.586158,0.129329
938,2,7,"i brought a hdmi roku stick and a google chrome cast stick but the problem with both of them are the a good for netflix but the wi fi signal that emits from them a so strong that it knocks out the antenna signal to the tv and you have to remove the usb cable to the sticks to cut the power from them to receive the antenna signal.",1,0,7,0.586064,0.204188
938,2,8,"again its in my kitchen so i don t want a at t or cable box mounted to the wall to watch tv.",1,0,7,0.473597,0.135639
939,2,0,"nice picture  good selection of ports  acceptable sound  feels solid  runs cool  serviceable remote  sturdy stand.",0,0,2,1.000000,1.000000
939,2,1,"no observable motion blur on broadcast tv  eg  sports ",0,0,5,0.642156,0.241050
939,2,2,"horrible  smart  functions  slow to respond and dated in appearance.",1,1,10,0.574983,0.155057
939,2,3,"poor viewing angles.",1,1,10,0.595631,0.204507
939,2,4,"picture quality varies depending on content  best with sports  not so hot on darker scenes .",1,1,12,0.522050,0.241050
939,2,5,"takes several seconds to power up  hisense logo displays during this time.",1,1,9,0.543227,0.221437
940,2,0,"very nice picture  decent speakers  good selection of inputs",0,0,7,1.000000,1.000000
940,2,1,"the  smart  aspect of this tv left me with much to be desired.",1,1,10,0.636116,0.242761
940,2,2,"apps were limited  flaky  and often the menu system would hang  necessitating cycling power.",1,1,10,0.558374,0.155057
940,2,3,"i added a chromecast dongle for 25 bucks  and life is good.",1,1,9,0.583380,0.204507
940,2,4,"can t complain about it much  considering the price.",1,1,9,0.519301,0.221437
941,2,0,"low price  fast shipping  great picture  smart tv.",0,0,1,1.000000,1.000000
941,2,1,"in all honesty non so far  aside from one little scuff on the back side of the tv.",1,1,13,0.606082,0.223050
942,2,0,"it s an lg",0,0,5,1.000000,1.000000
942,2,1,"i can t see the price without adding it to my cart and starting the checkout process ",1,1,9,0.563903,0.156283
942,2,2,"i was going to buy a tv  but it won t be that one  and probably not from new egg now.",1,1,8,0.550139,0.142275
943,2,0,"the image is very nice.",0,0,3,1.000000,1.000000
943,2,1,"i bought this as an upgrade for a 12 year old 36  crt tv for the bedroom.",0,0,3,0.592703,0.242761
943,2,2,"my wife loves it ",0,0,3,0.640773,0.242761
943,2,3,"extremely limited input and output options.",1,1,12,0.645495,0.264404
943,2,4,"i attempted to read the panasonic pages as well as the specification pages here on newegg but somehow i missed the fact that this thing has no analog audio outputs at all ",1,1,12,0.529365,0.159262
943,2,5,"the only output is an optical digital.",1,1,12,0.522493,0.186982
943,2,6,"optical digital is great if you want to hook into a home theater  but completely locks out a casual hookup to other equipment.",1,1,12,0.154769,0.122631
943,2,7,"i had to scramble to get a headphone option for my wife as she like to listen to tv after i go to sleep   i had to hook up an old surround sound amp just to get headphones.",1,1,12,0.319376,0.167865
943,2,8,"also  there are no analog audio inputs for use with video only hdmi.",1,1,12,0.618155,0.170642
943,2,9,"i had hoped to hook this to the second  dvi  output of my htpc in the next room  but to have audio i have to mux the audio in   now i m waiting to get the siig ce hm0031 s1 dvi   audio to hdmi converter   another   160.",1,1,9,0.194209,0.113071
944,2,0,"for integrated audio  it sounds great.",0,0,7,1.000000,1.000000
944,2,1,"very sharp picture with directv input.",0,0,7,0.611679,0.241050
944,2,2,"replacing a 24  tv and it is nice to see the larger images.",0,0,5,0.581182,0.241050
944,2,3,"the manual leaves a lot to be desired.",1,1,15,0.591543,0.202993
944,2,4,"i had to get assistance from toshiba to even get a picture.",1,1,15,0.571008,0.129329
944,2,5,"the technical manual writers need to go back to school.",1,1,15,0.529180,0.141140
945,2,0,"great for the price.",0,0,6,1.000000,1.000000
945,2,1,"works as tv or pc monitor.",0,0,3,0.577741,0.242761
945,2,2,"not led  this is an lcd.",1,0,3,0.564076,0.142275
946,2,0,"easy setup great picture quality  multiple choices for aspect ratios 2 000 000 1 contrast ratio excellent visibility from any viewing angle straightforward menu reasonable sound quality clean lines no image streaking  excellent sports viewing sd card input",0,0,2,1.000000,1.000000
946,2,1,"no anti glare coating single digital optical audio output limits sound options two hdmi ports limits number of external devices cats  auto dimming  feature is more of a nuisance than a benefit",1,1,12,0.544991,0.216559
947,2,0,"good size  good picture  simple menus.",0,0,2,1.000000,1.000000
947,2,1,"best of all    the price.",0,0,2,0.628354,0.155057
947,2,2,"like all plasma screens  the glossy screen reflects a bit.",1,1,8,0.545855,0.202993
947,2,3,"not a big deal though.",1,1,14,0.564814,0.142275
948,2,0,"price point excelent.",0,0,2,1.000000,1.000000
948,2,1,"set very easy.",0,0,2,0.635596,0.223050
948,2,2,"the hd in 720p is stunning.",0,0,0,0.599739,0.129329
948,2,3,"could have used audio output pair.",0,1,12,0.617373,0.156283
948,2,4,"but has optical out  so no lost egg.",0,1,12,0.594591,0.129329
948,2,5,"tv sound is about right or flat panal tvs.",0,1,12,0.571395,0.156283
948,2,6,"has a little glare  but not a problem.",0,1,12,0.670306,0.307512
948,2,7,"burn in wont be a problem with this unit.",0,1,12,0.191960,0.110635
948,2,8,"lots of adjustments for tweekers like me.",0,1,12,0.570450,0.234363
948,2,9,"the price i got from newegg will be hard too beat. 566",0,0,2,0.525857,0.156283
948,2,10,"with discount coupon and free door delivery.",0,0,1,0.558244,0.128282
948,2,11,"in fact ait took it in the house for me.",0,0,4,0.527563,0.129329
948,2,12,"all in all  i would highly recommend this tv for people looking for great value and outstanding hdtv...",0,0,4,0.489611,0.223050
949,2,0,"love this tv.",0,0,4,1.000000,1.000000
949,2,1,"this is first plasma tv purchase  and after much research choose this set.",0,0,4,0.587455,0.242761
949,2,2,"it took 30 minutes to start watching television atfter wall mounting.",0,0,4,0.573774,0.155057
949,2,3,"easily integrated with receiver for the best possible sound.",0,0,4,0.677521,0.262593
949,2,4,"hook up satellite receiver  dvd player  next purchase is blu ray player  and wii.",0,0,0,0.334841,0.172968
949,2,5,"still have plenty of hdmi ports to use.",0,0,7,0.570292,0.155057
949,2,6,"sound out of speakers is not that great.",1,0,7,0.526176,0.223050
950,2,0,"after 15 days searching  surfing and reading reviews i did but this one.",0,0,4,1.000000,1.000000
