Doc ID, Source, SentenceIndex,Sentence, ActualSentiment, PredictedSentiment, PredictedTopic, TopicTransitionProbabilty, SentimentTransitionProbabilty
848,2,0,"decent image quality.",0,0,6,1.000000,1.000000
848,2,1,"media play function is neat.",0,0,7,0.614539,0.128282
848,2,2,"speakers better than some.",0,1,12,0.610780,0.155057
848,2,3,"confusing remote.",1,1,15,0.600251,0.129329
848,2,4,"tv picture lags a bit when changing channels.",1,1,9,0.528439,0.128282
848,2,5,"usb quit working.",1,0,7,0.569253,0.156283
848,2,6,"so so picture quality.",1,0,6,0.526176,0.142275
853,2,0,"tv has great viewing angles and built in gaming mode for when you want to play games with it.",0,0,0,1.000000,1.000000
853,2,1,"better looking image then other 4k tvs",0,0,3,0.621735,0.242761
853,2,2,"smart tv has adds now and then which are a slight annoyance.",1,1,15,0.581268,0.156283
853,2,3,"for good audio needs a sound bar or sound system.",1,1,12,0.518569,0.223050
855,2,0,"great tv at a great price.",0,0,1,1.000000,1.000000
855,2,1,"don t let the refurbished scare you off.",0,0,1,0.640931,0.241050
855,2,2,"bought it about 6 months ago.",0,0,1,0.566358,0.156283
855,2,3,"works great.",0,0,1,0.600251,0.204507
855,2,4,"easy to set up.",0,0,1,0.562042,0.202993
855,2,5,"nice selection of inputs.",0,0,7,0.530123,0.202993
855,2,6,"not free....nothing that i ve found.",1,0,1,0.554230,0.221437
856,2,0,"nice size  excellent picture  enough ports  digital audio out.",0,0,0,1.000000,1.000000
856,2,1,"wish i could label hdmi ports and also remove ota tv from inputs list.",1,0,0,0.385230,0.142847
856,2,2,"a very minor thing.",1,1,15,0.575155,0.142275
857,2,0,"looks brand new out of the box  packaged and shipped well.",0,0,1,1.000000,1.000000
857,2,1,"works like a new tv should.",0,0,1,0.631646,0.128282
857,2,2,"great picture and color  after very little adjusting .",0,0,6,0.539546,0.242761
857,2,3,"is as advertised.",0,0,3,0.571052,0.223050
858,2,0,"wonderful picture  decent sound  easy setup  3 hdmi   digital coax out   thin bezel.",0,0,0,1.000000,1.000000
858,2,1,"no analog sound out.",1,0,0,0.373386,0.085796
858,2,2,"only 60mhz not 120mhz  but haven t noticed any ghosting.",1,0,0,0.550139,0.142275
859,2,0,"i already had one sanyo 42  with a few more bells and whistles that i did a lot of research on before buying  but this one looks just as good.",0,0,1,1.000000,1.000000
859,2,1,"considering i got the first one at you know where on black friday for  450 this is a great deal.",0,0,0,0.387043,0.127127
862,2,0,"good deal for the money.",0,0,1,1.000000,1.000000
862,2,1,"works just as it should.",0,0,1,0.628354,0.242761
862,2,2,"doesn t have the sound issues that i have seen with more expensive tv s",0,0,5,0.543053,0.129329
862,2,3,"more video inputs would be nice  but not gonna complain it holds all my current devices.",1,1,9,0.518569,0.141140
863,2,0,"incredible picture quality  can plug my hardrive right into the usb port and watch movies and tv shows off of it  not many tv s can do it.",0,0,7,1.000000,1.000000
863,2,1,"speakers are loud and clear.",0,0,7,0.621776,0.155057
863,2,2,"one of the 4 hdmi ports is a pain sometimes.",1,0,7,0.536123,0.142275
864,2,0,"just set this up this morning after getting it for eight hundred on black friday.",0,0,2,1.000000,1.000000
864,2,1,"i love the ultra thin and simplistic bezel.",0,0,2,0.606265,0.204507
864,2,2,"picture is stunning.",0,0,2,0.621046,0.202993
864,2,3,"had some input lag when first connecting my xbox   this is eliminated by turning the tv to game mode  which i believe enables the  vyper drive   as i don t see a standalone option  and disabling the image processing options like opc  noise reduction  etc.",0,1,9,0.644201,0.204188
864,2,4,"i didn t notice a drop in picture quality after doing this  and those options save specifically for your game console s input.",0,1,12,0.239052,0.077897
864,2,5,"wifi set up was easy but had only medium connection strength....i ll likely go wired  but ymmv.",0,0,7,0.591543,0.156283
864,2,6,"usb input is a big plus  and it plays many movie types   avi  mkv  asf  and more.",0,0,7,0.544506,0.155057
864,2,7,"sound quality is as good as other sets  but i will be using my surround sound soon instead.",0,1,12,0.545959,0.242761
864,2,8,"  only one component input   no biggie as i ll move over to hdmi.",1,1,12,0.547412,0.204507
864,2,9,"  apps include vudu  netflix  youtube  but no hulu    maybe that will be updated  pleaseplease ",1,1,10,0.512299,0.142275
865,2,0,"picture quality is outstanding  sound quality is very good for a thin tv  streams services like netflix very well  nice configuration options  uses the same lcd panel as samsung s top end products  passes through dd and dts sound from sources  streaming  hdmi  to the optical out connection   for the quality of the tv the price is very reasonable.",0,0,7,1.000000,1.000000
865,2,1,"don t expect much in the web browsing area.",1,1,8,0.608746,0.223050
866,2,0,"i am very impressed with this product the color and sound are excellentand the price got it during cyber monday last year.",0,0,2,1.000000,1.000000
866,2,1,"after watching a movie if i did not go back out to select another program soon or exit out the end of the movie would stay locked on the screen and you could not cut the tv off by the tv off button or the remote off button.thankfully this was a common problem and a technian from vizio told how to reset the tv.after doing what he instructed me to do several times 4 or 5 it stopped and l have not had any other issues.",1,1,9,0.544804,0.223050
868,2,0,"easy set up wifi works well with d link router vizio internet apps include netflix  youtube  and hulu perfect for the kitchen great value on refurbished equipment reasonable quality image  not great  not bad ",0,0,7,1.000000,1.000000
868,2,1,"no hbo go sound okay but not great  though this is pretty much par for the course with most low cost flat screens  can hook into soundbar ",1,0,7,0.469206,0.131415
869,2,0,"product arrived quickly and as dexcribed.",0,0,4,1.000000,1.000000
869,2,1,"seems to work very sel lso far.",0,0,4,0.639423,0.155057
869,2,2,"this is my first vizio  i have a larger samsung.",0,0,4,0.587289,0.129329
869,2,3,"i was a little surprised at how light the tv is.",0,0,2,0.595529,0.155057
869,2,4,"seems cheap but this may be normal for 32  tv.",0,0,3,0.583278,0.128282
869,2,5,"i have some issue with wifi signal strenght but contacted vizio and spoke to an actual perosn who was most helpful  i like that a lot.",0,0,3,0.543053,0.156283
869,2,6,"picture and sound quality are very good.",0,0,6,0.572357,0.204507
869,2,7,"overall after a few days i must say i am quite please with the purchase.",0,0,4,0.566870,0.241050
869,2,8,"extremelty easy to use app s  netflix ",0,0,2,0.519301,0.129329
869,2,9,"wifi receiver a bit weak",1,1,13,0.510182,0.142275
870,2,0,"arrived damaged  so can t comment",0,1,13,1.000000,1.000000
870,2,1,"the tv arrived damaged  so i can t comment on its qualities",1,1,13,0.085580,0.092721
871,2,0,"it is overall a great tv.",0,1,12,1.000000,1.000000
871,2,1,"i ordered it to use my xbox on and it does that without a problem.",0,1,9,0.587455,0.202993
871,2,2,"goes to 1080p with hdmi so i m not sure why the recommended hd was 720p.",0,1,9,0.580863,0.242761
871,2,3,"if you are looking for a tv to play games on this is it i feel.",0,1,12,0.596178,0.202993
871,2,4,"as far as television and movies it has great picture and sound quality.",0,1,8,0.625442,0.307512
871,2,5,"the sound is astoundingly good from the built in speakers.",0,1,8,0.317806,0.085478
871,2,6,"the only con i can think of is the base for the tv is a little cheap.",1,1,8,0.536725,0.221437
873,2,0,"crisp clear picture  small bezel  easy interface and menu",0,0,2,1.000000,1.000000
873,2,1,"built in speakers aren t very good.",1,1,8,0.596651,0.223050
875,2,0,"not too heavy great size adequate bezel width great input options easy to configure sound is pretty decent too  wonderful color  great brigtness and lots of options for setting up.",0,0,1,1.000000,1.000000
875,2,1,"the stand is glass  which is kind of a delicate substrate for it.",1,1,13,0.624702,0.202993
875,2,2,"is not a  smart  tv   so you will have to provide your own  netflix   hulu  streaming etc. off brand with an almost comical  chinese  sounding name   but it adds to its charm.",1,1,15,0.533312,0.142275
876,2,0,"very cheap for a 50 .",0,0,3,1.000000,1.000000
876,2,1,"but it works nice even over a year now",0,0,3,0.557032,0.221437
877,2,0,"pretty great tv for  359 with rebate card.",0,0,1,1.000000,1.000000
877,2,1,"replaced my old 2006 42  pan plasma.",0,0,1,0.238877,0.125610
877,2,2,"weighs less than half of that 100lb beast.",0,0,1,0.637516,0.156283
877,2,3,"better speakers than the 32  one i bought.",0,0,4,0.564580,0.128282
877,2,4," same brand   haven t hooked it up to the computer as of yet  but its intended for tv and movies.",0,0,3,0.583278,0.155057
877,2,5,"very low heat compared to the old plasma s radiation.",0,0,4,0.581268,0.129329
877,2,6,"hooks up to my lap top edge to edge with a few tweaks in display settings.",0,0,0,0.619197,0.205708
877,2,7,"really really good picture on hd stuff and surfing thru the lap top.",0,0,0,0.349482,0.143015
877,2,8,"wouldn t expect it to be a great computer monitor for gaming but will do a follow up after i try it out.",1,0,3,0.524938,0.155057
877,2,9,"took a little tweaking to get the base set up straight.",1,0,3,0.537650,0.223050
878,2,0,"  low cost  low cost  low cost   3 hdmi inputs   acceptable quality  blackness   refresh rate   easily adjustable picture balance",0,0,0,1.000000,1.000000
878,2,1,"  turning on takes a few secs  no big deal   non existent customer service   it supposedly plays movies from a usb stick  but the formats i tried were not accepted.",1,1,14,0.542004,0.137937
881,2,0,"works amazingly for a refurbished tv  i really settled when i decided to get a 720p tv and i actually dont regret it  the picture quality is amazing  the screen had no scratches or any signs of wear  i thought i might have been sent a new tv on accident ",0,0,1,1.000000,1.000000
881,2,1,"the very few problems i did have with this tv were minor  the 3rd hdmi input does not work  but that doesnt matter to me.",1,1,15,0.430399,0.169223
881,2,2,"the speakers are a little buggy  for the most part it works great  but if i play a game where the music blasts suddenly or has very high bass the speakers get really loud  beyond what the volume setting is  and it seems like the speakers will blow out.",1,1,12,0.440474,0.210427
882,2,0,"great price and it suits all expected needs.",0,0,1,1.000000,1.000000
882,2,1,"pleasant surprise that it had 4 hdmi ports.",0,0,7,0.601570,0.241050
882,2,2,"my spouse is happy  actually has reconnected with tv viewing.",0,0,4,0.611763,0.202993
882,2,3,"nicely packaged.",0,0,1,0.570922,0.128282
882,2,4,"low volume output  but hope to rectify that with visio soundbar.",1,1,12,0.529092,0.241050
882,2,5,"no batteries were included.",1,1,13,0.550227,0.142275
883,2,0,"nice tv for the price.",0,0,6,1.000000,1.000000
883,2,1,"nice picture.",0,0,6,0.186565,0.072948
883,2,2,"this tv is new   walmart for 260.00 so buying refurb i saved about 50.00.",0,0,2,0.576732,0.241050
883,2,3,"nice that it has many buttons on this side for power  etc.",0,0,2,0.579758,0.242761
883,2,4,"i have another vizio that doesn t.",0,0,4,0.593041,0.204507
883,2,5,"may come in handy when the kids loose the remote.",0,0,4,0.544166,0.156283
883,2,6,"frame of tv has many scratches and scuffs",1,0,4,0.505016,0.141140
884,2,0,"was rma able  one of two customer service reps was helpful.",0,1,14,1.000000,1.000000
884,2,1,"functionality.    first tv was received may 30th and rma d due to a line at the top of the screen.",1,1,13,0.595462,0.156283
884,2,2,"first customer service rep was very empathetic and helpful even offered rapid shipping.",1,1,14,0.672164,0.205708
884,2,3,"tv shipped back june 2nd.",1,1,14,0.205908,0.075702
884,2,4,"  second tv was received on june 19th and only half of a functioning screen  the right half .",1,1,9,0.600610,0.205708
884,2,5,"second rep was less than helpful  didn t even seem to care that we originally ordered the tv on may 23rd and still have no television.",1,1,13,0.411445,0.131415
885,2,0,"great condition.",0,0,1,1.000000,1.000000
885,2,1,"works like new.",0,0,1,0.636500,0.202993
885,2,2,"setup is easy.",0,0,2,0.581140,0.155057
885,2,3,"very plug and play for a refurb  its not all that bad.",0,0,7,0.572587,0.241050
885,2,4,"very little trash with packaging.",0,1,13,0.598349,0.202993
885,2,5,"comes with remote  2 batteries   power cable  and a small setup guide...simple.",0,1,13,0.518503,0.155057
885,2,6,"packaging was a little rough.",1,1,13,0.576232,0.129329
885,2,7,"no detailed instruction manual  but it takes common sense to put it together.",1,1,13,0.502756,0.142275
886,2,0,"surprisingly  it actually turns on  and it arrived relatively quick.",0,0,4,1.000000,1.000000
886,2,1,"the television is in bad shape  poorly packaged and looked very used.",1,1,13,0.619666,0.241050
886,2,2,"one of the clips on the stand for the base was broken  but that seemed minor compared to the rest.",1,0,4,0.591390,0.202993
886,2,3,"i honestly couldn t believe vizio would actually send something like this to a customer.",1,1,14,0.611746,0.129329
886,2,4,"i should have immediately sent it back  but i rather not deal with the grief of trying to return or exchange it.",1,1,14,0.596940,0.128282
886,2,5,"i m just writing it off as money in the garbage.",1,1,14,0.591543,0.155057
886,2,6,"sadly  i bought it as a present for my father  and now i find myself having to buy another television since i told him i was getting him one.",1,1,8,0.526946,0.155057
886,2,7,"there was no way i could give him the set vizio sent me.",1,1,11,0.566870,0.128282
886,2,8,"this was the very first time i purchased something  refurbished   and it the last time.",1,1,11,0.512247,0.156283
886,2,9,"lesson learned  i tried to save a little money and in the end it will cost me a lot more.",1,1,14,0.520763,0.141140
887,2,0," excellent picture quality  very rich deep blacks  smart tv works great.",0,0,6,1.000000,1.000000
887,2,1,"wi fi set up is a snap.",0,0,7,0.648923,0.204507
887,2,2," plays all formats of movies i have thrown at it over the network.",0,0,7,0.591401,0.129329
887,2,3,"looks great in our family room.",0,0,4,0.684489,0.307512
887,2,4," very little room reflection on the panel.",0,0,4,0.199452,0.153131
887,2,5," remote is backlit",0,0,3,0.672268,0.170642
887,2,6," would like the remote back light to be brighter.",1,0,3,0.077173,0.080716
887,2,7," netflix app seems to be quiet low on volume compared to other transmissions  stand is kind of funky.",1,0,3,0.591925,0.170642
887,2,8,"would have like a more solid stand.",1,0,3,0.345109,0.123323
888,2,0,"the picture quality on this tv is extremely good.",0,0,6,1.000000,1.000000
888,2,1,"the problem is that samsung plasma technology is unreliable.",0,0,5,0.694972,0.264404
888,2,2,"the company will only warranty this very expensive high end plasma tv for one year  which is quite telling.",0,1,14,0.344843,0.167865
888,2,3,"my tv developed a number of rows of dead pixels going from the right to the left of the display.",0,1,10,0.673738,0.171967
888,2,4,"this happened a few weeks after the warranty period had ended and despite begging and pleading samsung told me that i was solely responsible for the  900 cost to replace the entire plasma display.",0,1,14,0.351599,0.107421
888,2,5,"i had to throw the tv in the dumpster..... what a waste of money.",0,1,14,0.592175,0.204507
888,2,6,"google  dead pixel samsung tv  to read about this frequent problem.",0,0,4,0.591813,0.205708
888,2,7,"in the dumpster after one year  samsung customer support unwilling to help.",1,1,10,0.368045,0.203538
889,2,0,"good picture quality  easy online access to netflix  youtube  etc.",0,0,6,1.000000,1.000000
889,2,1,"sound is a little muddy  headphone jack and other jacks are inconveniently located in the back  when you first turn the tv on  the color is wrong and then resets.",1,1,9,0.588615,0.223050
890,2,0,"clear crisp picture  included wifi",0,0,7,1.000000,1.000000
890,2,1,"the apps on it are mediocre.",1,1,10,0.623767,0.155057
890,2,2,"but i ve bought a roku anyways.",1,1,11,0.550139,0.142275
891,2,0,"i m not a tv expert  thus don t have similar tv s to compare...that said  picture quality is great  setup easy  i choose free ship  went from memphis tn to florida in 2 days...ty newegg...i always shop around  and i always end up buying from newegg  best     shipping cust service...packaging was quality  airbags  wrapping....when u turn on tv  no pic is displayed  till you tell the tv where input is from   fyi  tv has no buttons   all done via remote...all settings via remote are easy...there are numerous choices  for adjusting pic quality...this was a refurb...came with remote power cord quick start quide...full guide is on screen  accessible by remote...everything is functioning perfectly  wired wireless good  no flaws   all pixels good  ...this is an eggcelent tv...a superb tv...i highly recommend...i would buy 10",0,0,4,1.000000,1.000000
891,2,1,"3 screws to mount the base not included...i believe an oversite from refurb place...2 aaa batteries not included normal  fyi edging at the top popped off and was stuck on the top of tv..had to pull edging forward which quickly went into correct fitting...i again have to suspect refurb place  as edge is very tight around tv  so very unlikely shipping did that...i did have to call visio support  they are good   some smart tv apps weren t accessible... they had me go to a onscreen tab  and select update firmware...took 10 min...these cons  are very minor and all were fixed.",1,1,10,0.483900,0.132232
892,2,0,"great picture  easy menu  easy setup with directv remote.",0,0,2,1.000000,1.000000
892,2,1,"flimsy stand",1,1,13,0.606082,0.221437
893,2,0,"the tv was cheap and seemed like a good deal.",0,1,15,1.000000,1.000000
893,2,1,"i d like to assume all of the cons comes from this being a refurbished tv.",1,1,13,0.629940,0.204507
893,2,2,"the screen has a group of dead dark pixels that made a black spot on the screen.",1,1,10,0.581140,0.155057
893,2,3,"it s pretty big so i have no idea how that got past the quality control people.",1,1,15,0.578107,0.155057
893,2,4,"there is no way i could deal with that  so i m returning it now.",1,1,15,0.595631,0.156283
893,2,5,"the remote also hardly worked.",1,1,15,0.555354,0.156283
893,2,6,"with fresh batteries it would take 3 4 clicks to make something happen.",1,1,13,0.539677,0.128282
893,2,7,"the color also took forever to adjust as the defaults are really bad.",1,1,13,0.509816,0.221437
894,2,0,"great picture  smart tv apps that i find useful  unlike those for many other tvs   easy setup.",0,0,2,1.000000,1.000000
894,2,1,"no difficulties with the refurbished unit.",0,0,4,0.601739,0.221437
895,2,0,"good tv  high resolution and good picture.",0,0,6,1.000000,1.000000
895,2,1,"nice and bright with little light bleed from the top and the bottom.",0,0,2,0.607663,0.129329
895,2,2,"sound is weak and tinny  not bad for tv speakers but not going to impress anyone.",1,1,12,0.583278,0.242761
895,2,3,"smart interface can be slow and laggy at times.",1,1,10,0.566818,0.128282
895,2,4,"wireless connection for internet seems flakey  with direct connection with ethernet  no issues.",1,1,10,0.519301,0.141140
896,2,0,"the design is sleek and set up is easy.",0,0,7,1.000000,1.000000
896,2,1,"the colors are bright and has many settings to customize.",0,0,7,0.344424,0.083415
896,2,2,"vizio s tech support is great.",0,1,10,0.613220,0.241050
896,2,3,"this model has the most basic network connectivity software.",1,1,10,0.676126,0.264404
896,2,4,"it can only use wpa2 less sophisticated tkip cipher type to connect to the wifi.",1,1,10,0.494303,0.180860
896,2,5,"this means that if you have a router that downgrades the wifi security from the normal eas down to basic tkip  then your newer devices such as laptops and ipads may not connect to the internet.",1,1,10,0.152536,0.072934
896,2,6,"also  while the tv set up was easy  the network setup was unnecessarily difficult.",1,1,10,0.665294,0.205708
896,2,7,"it required me and vizio s tech support over 2 hours to figure out that the tv is using the older outdated network software  which most updated home wifi systems will require wifi extenders configured down to meet both your newer ipads and this vizio s network requirements.",1,1,10,0.311186,0.086463
896,2,8,"therefore  i m returing this tv because i can t use the smart tv functions.",1,1,10,0.593350,0.156283
896,2,9,"also  this tv uses edge led lighting with not so great graphics display software.",1,1,9,0.604265,0.262593
896,2,10,"this means that if you use this as an external monitor  you will be disappointed with even simple things as a plain black and white word document displaying just text.",1,1,15,0.498919,0.246660
896,2,11,"don t let others tell you that a 1080p tv can easily serve as a computer monitor.",1,1,9,0.495154,0.287966
896,2,12,"take my lessons learned  it can t  if you want a monitor  then invest in a good monitor.",1,1,9,0.212624,0.181214
897,2,0,"i m using the tv as a monitor for my pc.",0,0,3,1.000000,1.000000
897,2,1,"it s connected via the adapter s hdmi port so the picture quality is excellent.",0,0,7,0.668509,0.309503
897,2,2,"it s also connected to a roof antenna and to my cable router.",0,0,7,0.349981,0.138163
897,2,3,"the picture quality from pc streaming video and tv reception are both excellent.",0,0,7,0.558985,0.242761
897,2,4,"the smart tv feature is a bonus.",0,0,7,0.589628,0.204507
897,2,5,"i plan on a netflix subscription and expect it to work as well as streaming youtube direct to the tv works.",0,0,3,0.512504,0.155057
897,2,6,"wish it had more than one hdmi port but that s not enough to take away an egg.",1,1,9,0.552485,0.142275
898,2,0,"decent size for a 19 .",0,0,3,1.000000,1.000000
898,2,1,"speakers sound great and screen clarity couldn t be better.",0,0,4,0.591390,0.242761
898,2,2,"overall worth the money",0,0,1,0.607764,0.129329
898,2,3,"only bad thing about mine was one of the buttons on the remote were a bit messed up but still functions.",1,1,15,0.528454,0.242761
898,2,4,"not worth a loss of an egg.",1,1,8,0.563352,0.221437
899,2,0,"delivered fast.",0,1,14,1.000000,1.000000
899,2,1,"repair guys come to your home.",0,1,14,0.591458,0.129329
899,2,2,"doa  called samsung and they are going to send someone out to my house to fix the issue.",1,1,14,0.524868,0.142275
900,2,0,"this is my first lcd tv and i did quite a bit of looking around before i bought this.",0,0,3,1.000000,1.000000
900,2,1,"when i was at the store i was impressed with it.",0,0,3,0.629940,0.204507
900,2,2,"once i hooked it up at home  i was blown away by it.",0,0,0,0.621735,0.242761
900,2,3,"i didn t realize how much detail we had been losing from our previous tv.",0,0,0,0.586351,0.155057
900,2,4,"one of the great features  besides the inputs and the display quality  is the automatic brightness control.",0,0,7,0.535032,0.204507
900,2,5,"it works very well and it is virtually seemless.",0,0,7,0.590875,0.242761
900,2,6,"the picture just looks right regardless of the ambient light.",0,0,2,0.518569,0.128282
900,2,7,"there is also a setting so you can see when it is adjusting the display brightness.",0,0,2,0.502756,0.142275
901,2,0,"picture quality is outstanding  unit   looks very sleek.",0,0,5,1.000000,1.000000
901,2,1,"bezel shows smudges  only 1 component input  and sound is weak.",1,1,9,0.563990,0.141140
902,2,0,"great picture   using a dvi to hdmi cable it is an excellent monitor especially for someone with mediocre vision.",0,0,7,1.000000,1.000000
902,2,1,"when the kids use the computer the games don t appear to ghost at all.",0,0,5,0.624837,0.202993
902,2,2,"also it is bright and has a great matt to the screen   absolute zero glare.",0,0,6,0.575017,0.241050
902,2,3,"the vga connection suhuhuhux   don t even bother.",1,1,9,0.583380,0.242761
902,2,4,"use a dvi to hdmi connector.",1,1,9,0.533383,0.141140
903,2,0,"crystal clear  sharp pictures.",0,0,6,1.000000,1.000000
903,2,1,"no dead pixels.",0,0,0,0.627830,0.129329
903,2,2,"sleek design.",0,0,5,0.597270,0.156283
903,2,3,"great sound.",0,0,6,0.579758,0.242761
903,2,4,"brightness automatically adjusts according to brightness of the room.",0,0,6,0.541087,0.202993
903,2,5,"not the cheapest hdtv on the block  but more than made up in quality.",1,0,6,0.565093,0.129329
903,2,6,"fixed stand doesn t swivel  tilt  etc.",1,0,4,0.526176,0.142275
905,2,0,"it works and it s huge ",0,0,4,1.000000,1.000000
905,2,1,"my wife and i were joking about how big the people are on the tv.",0,0,4,0.611679,0.155057
905,2,2,"our old tv was a 32 inch.",0,0,3,0.591458,0.156283
905,2,3,"watch a few movies on it  great ",0,0,3,0.640405,0.309503
905,2,4,"hooked up my computer to it  great ",0,0,3,0.230166,0.080470
905,2,5,"none so far i was worried about the quality  because so many people like to complain.",1,0,4,0.529180,0.221437
906,2,0,"colors are realy nice  sides are very small  about 0.65 inch.",0,0,2,1.000000,1.000000
906,2,1,"good for multi screen   low price  paid 525 with shipping   1080p  when the tv is closed it have a nice look.",0,0,1,0.306593,0.101595
906,2,2,"refresh rate is realy disapointing.",1,1,12,0.622883,0.204507
906,2,3,"playing any games will give you headache eye hurt.layed",1,1,12,0.570922,0.129329
906,2,4,"black grey colors will make wierd black diagonal stripes like smoke.",1,1,12,0.550139,0.155057
906,2,5,"speakers are no much a thing  not a lot of plugs.",1,1,12,0.508029,0.142275
907,2,0,"the picture is fantastic.",0,0,6,1.000000,1.000000
907,2,1,"the set up was a little confusing and i had to reset it a couple of times.",1,1,10,0.581140,0.241050
907,2,2,"the sound is not  rich  as i was hoping but it will do.",1,1,12,0.581268,0.128282
