1000,2,3,"split screen is pretty sweet if you like to watch dvds and a game at the same time.",0,1,12,0.278540,0.101484
1000,2,4,"the tuner is a little slow to change channels but i knew that going in and was willing to live with that in exchange for a great picture at a great price.",1,1,15,0.531437,0.202993
1000,2,5,"plan on hooking it up to a home theater system  the speakers are pretty bad.",1,1,12,0.538551,0.221437
1001,2,0,"a great lcd hdtv for function and price ",0,0,4,1.000000,1.000000
1001,2,1,"i ve had this beauty for a couple years now  and have had no trouble whatsoever.",0,0,4,0.638209,0.204507
1001,2,2,"it s made here in the us  which makes me happy to see some competition for a change with overseas manufacturers.",0,0,5,0.613220,0.202993
1001,2,3,"i ve hauled this tv back and forth between apartments and used it for pc gaming and the usual movie television stuff.",0,0,3,0.617373,0.242761
1001,2,4,"it s fairly rugged and lightweight.",0,0,4,0.594591,0.129329
1001,2,5,"even the built in speakers have a decent range.",0,0,7,0.571395,0.155057
1001,2,6,"more than enough audio video data inputs to please most users.",0,0,7,0.589422,0.156283
1001,2,7,"no dead pixels....beautiful picture ",0,0,6,0.545228,0.128282
1001,2,8,"keep up the good work olevia ",0,0,6,0.577356,0.242761
1001,2,9,"thanks newegg ",0,0,4,0.567826,0.156283
1001,2,10,"i had no trouble while performing the firmware upgrade.",1,0,7,0.509082,0.204507
1001,2,11,"i found it simple enough  but can imagine it could be difficult for the normal home user to figure out.",1,1,13,0.527563,0.241050
1001,2,12,"i don t believe it is going to always be necessary to update it  but the process should come with better documentation for the less tech savvy.",1,1,10,0.507262,0.141140
1002,2,0,"tv looks great.",0,0,4,1.000000,1.000000
1002,2,1,"easy to setup and mount.",0,0,4,0.656380,0.262593
1002,2,2,"lightweight which helped with mounting on the wall.",0,0,4,0.264392,0.100721
1002,2,3,"got a great price on this tv with a new egg sale.",1,1,8,0.539677,0.221437
1003,2,0,"you won t find a better television .",0,1,8,1.000000,1.000000
1003,2,1,"when you set this tv up the right way it will take your breath away.",0,1,8,0.637516,0.155057
1003,2,2,"not sure about the  other guy s   review.",0,1,8,0.562548,0.129329
1003,2,3,"i actually purchased his returned set ",0,1,11,0.544506,0.128282
1003,2,4,"just more 4k content which isn t samsung s fault",1,0,6,0.533383,0.142275
1004,2,0,"amazing picture with 4k source",0,0,5,1.000000,1.000000
1004,2,1,"this television is years ahead of technology  yes that s a bad thing  ",1,0,5,0.606480,0.241050
1004,2,2,"according to samsung  very helpful troubleshooting   the 4k takes the source and multiplies it by 4. what s this mean to the average buyer ",1,1,9,0.590458,0.242761
1004,2,3,"1080i is unwatchable  1080p is shaky at best.",1,0,5,0.600251,0.204507
1004,2,4,"i had an av expert come and spend 2 hours trying to change the settings to make it usable without success.",1,0,4,0.635313,0.309503
1004,2,5,"also  my set had an issue with the sound through the tv speakers that caused me to have to unplug it every other time the set was used to correct.",1,0,4,0.205493,0.130200
1004,2,6,"samsung finally admitted that source technology is not there   that it really is only good for up converted blu rays.",1,0,5,0.526176,0.142275
1005,2,0,"this tv has to many pro s to list  it s one of the fastest smart tv s  you have to accept that it is only 60hz really w  their clear motion and game more it the best looking 32  tv on the market today   60hz.",0,0,5,1.000000,1.000000
1005,2,1,"now if you want true 120hz then this isn t the tv for you but if your looking for a very sweet looking 60hz smart tv with lots of inputs and nice gaming and movie quality  then look no further.",0,0,5,0.242349,0.096763
1005,2,2,"not true 120mhz",1,0,5,0.342441,0.191348
1006,2,0,"i have lg tvs for 3 years   this one i bought about year ago and it s been repaired 5 times for same issues by lg.",0,1,11,1.000000,1.000000
1006,2,1,"tech   but still have same issues with tv   plus going thru lg customer care team is worst.",0,0,5,0.300874,0.131609
1006,2,2,".i am not buying lg again ..",0,0,5,0.350033,0.176198
1006,2,3,"lg customer care is worst service i ever received .",1,0,5,0.279122,0.192796
1007,2,0,"bought this for my father for father s day.",0,1,11,1.000000,1.000000
1007,2,1,"he had an older tv that was not a flat screen and was not high def.",0,1,14,0.577741,0.155057
1007,2,2,"after setting it up for him  it looks darn good  especially compared to his previous tv.",0,1,14,0.550139,0.221437
1008,2,0,"very nice clear picture.",0,0,6,1.000000,1.000000
1008,2,1,"good price but all tv s have been dropping in price.",0,0,6,0.591415,0.128282
1008,2,2,"i have several lg tv s and have been very happy with them",0,0,4,0.591543,0.128282
1008,2,3,"none  not a smart tv but i understood that prior to purchase",1,0,4,0.539677,0.221437
1009,2,0,"this 32 inch tv by lg is a good tv.",0,0,5,1.000000,1.000000
1009,2,1,"it has all the features i need and they all works good.",0,0,7,0.222858,0.076641
1009,2,2,"the tv setup quickly and easily and was easy to handle and manage.",0,0,4,0.591458,0.242761
1009,2,3,"the picture is good.",0,0,6,0.584701,0.204507
1009,2,4,"there is no con on this tv but the blacks in tv viewing could be better.",1,1,8,0.614080,0.262593
1009,2,5,"it might be cuz it s a small tv but i had a 46 inch panasonic plasma and the blacks were better.",1,1,8,0.207509,0.112443
1010,2,0,"excellent picture and sound at a very competitive price.",0,0,6,1.000000,1.000000
1010,2,1,"very satisfied as a bedroom tv.",0,0,4,0.601739,0.142275
1011,2,0,"good price  fast newegg shipping and easy setup",0,0,1,1.000000,1.000000
1011,2,1,"specifications list swivel stand.",1,1,8,0.624578,0.202993
1011,2,2,"that is what ultimately was the difference that separated it from the samsung i was considering.",1,1,13,0.584701,0.155057
1011,2,3,"unfortunately despite also being listed on lg s website specifications  lg support says the tv does not come with a swivel stand.",1,1,14,0.511515,0.223050
1012,2,0,"it turns off by it self   no picture and stay blank for while  not a good tv",0,0,7,1.000000,1.000000
1012,2,1,"don t buy this tv",1,1,11,0.601739,0.221437
1013,2,0,"really is nice when i put in a blu ray movie.",0,0,3,1.000000,1.000000
1013,2,1,"3d is kinda cool when im playing games and stuff.",0,0,3,0.601570,0.204507
1013,2,2,"holding your finger on the dot button allows you to point at the screen and do stuff just like a wii remote.",0,0,0,0.573799,0.156283
1013,2,3,"very colorful tv",0,0,0,0.606082,0.129329
1013,2,4,"though the tv is great for movies and stuff  its a little big for gaming  plus its not as fast as my small monitor.",1,0,0,0.513991,0.242761
1013,2,5,"otherwise its a really nice tv",1,0,0,0.565155,0.141140
1014,2,0,"a guy i know purchased this tv and ended up having to rma it because it was broken upon delivery.",0,1,13,1.000000,1.000000
1014,2,1,"when he rma s it  they ended up sending him 2 tv s by accident.",0,1,10,0.339784,0.083051
1014,2,2,"when he called them about the additional tv  they just said to keep it.",0,1,10,0.610454,0.155057
1014,2,3,"he basically got this tv for free...i d say that was a pro",0,0,1,0.537493,0.128282
1014,2,4,"menu is a little finicky and the colors are a little washed out but nothing a few setting changes can t fix.",1,0,1,0.512247,0.141140
1015,2,0,"curve reduces nearly all of the light reflecting from surrounding room lights.",0,0,4,1.000000,1.000000
1015,2,1,"high def clarity is astounding and the picture is beautiful.",0,0,6,0.627653,0.155057
1015,2,2,"remote control features are easy to use and versatile.",0,0,6,0.581182,0.129329
1015,2,3,"still unable to connect the set to my home network.",1,1,10,0.581268,0.155057
1015,2,4,"phone support from samsung was average at best.",1,1,10,0.533312,0.202993
1015,2,5,"i had to download a file for firmware upgrade right out of the box that did not immediately resolve the problem.",1,1,10,0.529180,0.221437
1016,2,0,"1.  price 2.  brand name 3.  screen quality  4.  easy remote control w  easy set up 3.  shipping   handling   undamaged in 3 days    ",0,0,2,1.000000,1.000000
1016,2,1,"limited connections  2 hdmi and 1 usb  1 component ",1,1,9,0.140473,0.100081
1017,2,0,"10 bit 4 4 4 chroma at 30fps is very nice.",0,1,13,1.000000,1.000000
1017,2,1,"input delay is acceptable.",0,1,12,0.704793,0.309503
1017,2,2,"game mode supports 8bit 60fps with very low input delay.",0,1,12,0.246082,0.080516
1017,2,3,"no 4 4 4 at 60fps.",1,1,12,0.591594,0.129329
1017,2,4,"no 24p frame rate.",1,1,12,0.512247,0.142275
1018,2,0,"  great crisp picture   elegant curves   ample hdmi plugs and other media ports   usb plug for my chromecast so i dont have to have another electrical plug in the wall      very nice remote",0,0,7,1.000000,1.000000
1018,2,1,"would be very nice if these could get under the 1k price point.",1,0,7,0.433132,0.127435
1018,2,2,"that being said you do get what you pay for.",1,1,14,0.577913,0.221437
1019,2,0,"crisp picture  operates well  easy interface  apps work great.",0,0,1,1.000000,1.000000
1019,2,1,"great streaming capabilities  cuts out the middle man ps4  xbox  or blu ray player that you usually stream entertainment on ",0,0,7,0.417803,0.109175
1019,2,2,"no hbo go app on this tv as default  no app in app store for samsung.",1,1,10,0.562091,0.221437
1020,2,0,"picture quality is great and it s easy to use.",0,0,6,1.000000,1.000000
1020,2,1,"price is awesome.",0,0,6,0.634406,0.129329
1020,2,2,"when i try to use netflix the tv resets itself and goes back to channel 2. i have a strong internet connection so i don t know what the heck the problem is.",1,1,10,0.567843,0.241050
1020,2,3,"it s really annoying that the smart features suck that bad.",1,1,15,0.597343,0.128282
1020,2,4,"i would have gotten a regular tv if i knew this would happen.",1,1,9,0.673607,0.262593
1020,2,5,"just watching regular tv is fine.",1,1,9,0.107083,0.085763
1020,2,6,"hopefully the bug works itself out.",1,1,9,0.540235,0.142275
1021,2,0,"connected to dorm room cable and wireless effortlessly.",0,0,7,1.000000,1.000000
1021,2,1,"great picture.",0,0,7,0.611763,0.204507
1021,2,2,"doesn t come with hdmi cables....",1,0,7,0.550139,0.223050
1022,2,0,"super fast shipping from tn to nc  2 days with eggsaver .",0,0,1,1.000000,1.000000
1022,2,1,"easy set up.",0,0,6,0.633955,0.156283
1022,2,2,"netflix and hbogo worked first time no prob.",0,0,3,0.596335,0.129329
1022,2,3,"mounted easily.",0,0,4,0.612342,0.129329
1022,2,4,"picture quality quite good  from the limited time it worked .",0,0,6,0.560127,0.241050
1022,2,5,"set it up and mounted it on saturday night.",1,0,4,0.603867,0.204507
1022,2,6,"everything was working great.",1,0,4,0.565276,0.241050
1022,2,7,"sunday morning it wouldn t turn on.",1,1,11,0.574762,0.204507
1022,2,8,"standby power light wasn t even lit.",1,1,11,0.521441,0.156283
1022,2,9,"it was completely dead.",1,1,11,0.531091,0.129329
1022,2,10,"rma back to newegg.",1,1,11,0.519614,0.142275
1023,2,0,"this is the best tv i have ever owned ",0,0,6,1.000000,1.000000
1023,2,1,"i bought it as a second tv for the other living room  but it is now my main tv replacing my 1 year old 60  plasma tv.",0,0,4,0.580502,0.241050
1023,2,2,"crisp clear picture that is almost like you are standing there with you favorite sports teams  news anchors  or favorite tv stars ",0,0,6,0.619518,0.241050
1023,2,3,"i love this tv ",0,0,6,0.618804,0.129329
1023,2,4,"picture is too realistic.",1,0,6,0.570922,0.241050
1023,2,5,"i had to turn off the the clear motion 240 in order to watch tv shows because it all felt like i was sitting on the set and watching the show being made.",1,0,3,0.603408,0.204188
1023,2,6,"it honestly felt like someone made all the shows and movies i watched look like they were made with a cheap hand held camera because the picture is so good.",1,0,3,0.431503,0.275147
1023,2,7,"it does make it awesome when watching football though ",1,0,3,0.308157,0.120276
1024,2,0,"none  see cons ",0,1,13,1.000000,1.000000
1024,2,1,"tv arrived  box looked fine  open tv   screen was completely destroyed",1,1,13,0.536036,0.141140
1025,2,0,"absolutely magnificent image quality.",0,1,8,1.000000,1.000000
1025,2,1,"motion rates beyond virtually all other devices.",0,1,12,0.611679,0.129329
1025,2,2,"powerful and flexible operating system.",0,1,12,0.591458,0.156283
1025,2,3,"highly configurable to your needs.",0,1,8,0.598349,0.128282
1025,2,4,"serious lack of 4k content out there.",1,0,6,0.522050,0.155057
1025,2,5,"sound is  sufficient   you really need a soundbar or home theater setup.",1,0,6,0.529180,0.142275
1026,2,0,"great picture",0,0,7,1.000000,1.000000
1026,2,1,"if you want to use this tv as a monitor  as i do  you will be disappointed.",1,0,3,0.636500,0.202993
1026,2,2,"it has a pip function  but the pip can show only the coax input.",1,0,7,0.662722,0.307512
1026,2,3,"this tv has 4 hdmi 2.0 inputs  but you cannot use any of them as an input for the pip ",1,0,7,0.167883,0.086978
1026,2,4,"there is a multi link function that allows you to display two inputs side by side  but it reduces your screen area by up to 50 .",1,0,7,0.195156,0.110075
1026,2,5,"you are better off with two monitors ",1,0,3,0.587620,0.155057
1026,2,6,"there is just no technology reason for this in a product with an msrp of almost  3000.",1,0,5,0.518569,0.129329
1026,2,7,"samsung should be ashamed ",1,0,5,0.555485,0.141140
1027,2,0,"great product with excellent picture quality ",0,0,6,1.000000,1.000000
1027,2,1,"speedy delivery ",0,0,1,0.603767,0.221437
1028,2,0,"this is our second samsung tv and both purchases were based on great reviews.",0,0,4,1.000000,1.000000
1028,2,1,"the quality of the product and value and unbeatable ",0,0,1,0.618450,0.241050
1028,2,2,"no cons",1,1,13,0.571008,0.142275
1029,2,0,"great colors  pretty light weight and easy to assemble.",0,0,4,1.000000,1.000000
1029,2,1,"got it on sale for  330",0,0,1,0.618450,0.204507
1029,2,2,"stand isn t adjustable and firmware or software is pretty lag and not that responsive.",1,1,10,0.520036,0.141140
1030,2,0,"good price looks good  while it works ",0,0,1,1.000000,1.000000
1030,2,1,"does not fit standard tv mounts stops turning on after a few months terrible warranty service and customer support",1,1,14,0.545855,0.221437
1031,2,0,"hdmi  built in hd tuner  vga  great for watching videos from my laptop   fairly high brightness  no dead or stuck pixels after 6 months.",0,0,0,1.000000,1.000000
1031,2,1,"as with all cheaper lcd s  smooth color gradients have visible color steps  think underwater scenes in u571  or the grayish skies in gladiator .",1,1,12,0.639960,0.204507
1031,2,2,"this is only noticeable if you re looking for it though  not bad enough to draw your attention from the movie.",1,1,12,0.583278,0.242761
1031,2,3,"remote sensor not very powerful for me.",1,1,11,0.586124,0.202993
1031,2,4,"not sure if this is the tv but artifacts appear on edges and cornes of everything while using an n64 on this tv.",1,1,10,0.512247,0.142275
1032,2,0,"good tv and surprisingly good for comp monitor.",0,0,7,1.000000,1.000000
1032,2,1,"fuzzy w o hd",0,0,0,0.621735,0.204507
1032,2,2,"refuses to turn on about 40  of the time after being off over night and i have to unplug and replug it back in.",1,1,11,0.640405,0.170642
1032,2,3,"sometimes when i turn it on it has green lines all over and i have to turn it off and on again.",1,1,11,0.164997,0.105988
1033,2,0,"looks great with the xbox 360  and pc using vga out  the wii looks as good as a wii can look too ",0,1,12,1.000000,1.000000
1033,2,1,"the remote works great for me  i programmed my mce remote to turn the tv on off and how to use the volume control in about 10seconds.",0,1,15,0.426491,0.091104
1033,2,2,"it even took a wiimote to the screen  and the paint from the wiimote came off with a little bit of water  resilient ",0,1,13,0.581354,0.223050
1034,2,0,"crisp picture  good color when it worked.",0,0,6,1.000000,1.000000
1034,2,1,"dead after 13 months  slow source switching  gray ish blacks.",1,1,11,0.559023,0.223050
1035,2,0,"price after reading reviews i got skeptical.",0,0,4,1.000000,1.000000
1035,2,1,"but most reviewers were nitpicking.",0,0,4,0.159780,0.070572
1035,2,2,"displaying deep blacks is this displays weakness but not a fault.",1,1,14,0.621998,0.205708
1035,2,3,"this displays biggest weakness is my dishpvr remote won t control the television.",1,1,9,0.207164,0.111535
1036,2,0,"excellent hdtv picture.",0,0,6,1.000000,1.000000
1036,2,1,"no dead pixels.",0,0,0,0.637286,0.242761
1036,2,2,"no ghosting from computer or sports channel.",0,0,0,0.676719,0.170642
1036,2,3,"i don t have a game system hooked up  so i can t say what they might do  but my computer is cutting edge.",0,0,0,0.343093,0.103334
1036,2,4,"setup is fairly simple.",0,0,2,0.617741,0.129329
1036,2,5,"lots of inputs.",0,0,7,0.607552,0.128282
1036,2,6,"great as a computer monitor.",0,0,7,0.572587,0.202993
1036,2,7,"it plays well with dvd players too.",0,0,0,0.578656,0.242761
1036,2,8,"big  big  big.",0,1,15,0.570922,0.156283
1036,2,9,"the air  antenna  input needs to be reactivated every time the tv is turned on.",1,1,15,0.552705,0.129329
1036,2,10,"i have 2 of these units  so i know it s not just a defective unit.",1,1,11,0.565790,0.155057
1036,2,11,"it doesn t need to have the automatic channel scan run  just  switched  on in the setup menu.",1,1,15,0.621593,0.205708
1036,2,12,"the remote changes the channels slowly.",1,1,15,0.256335,0.081711
1036,2,13,"it s not too bad  but if you are a chronic channel surfer and aren t going to use a cable box  this could get annoying.",1,1,15,0.247884,0.163516
1036,2,14,"when you first turn on the tv  there is a 30 second delay before you can change channels  or access the setup menu.",1,1,9,0.464436,0.288891
1036,2,15,"if you shut it off on anything other than the cable tv input  you won t be able to see anything until you turn the channel and go to the setup menu to activate the  air  input.",1,1,9,0.185687,0.111585
1037,2,0,"i appreciate the look of this tv    mostly black.",0,0,5,1.000000,1.000000
1037,2,1,"the hd digital cable channels are stunning    especially football  baseball  basketball.",0,0,0,0.584166,0.156283
1037,2,2,"i ve had very reliable service from this unit  with absolutely no problems.",0,0,5,0.609707,0.204507
1037,2,3,"i paid over  900 for this tv in january 2006  but it was worth every penny.",0,0,1,0.586351,0.204507
1037,2,4,"i like the panels that come off to reveal the connections on the back of the tv  then go back into place  keeping the wires at least somewhat organized.",0,0,7,0.591543,0.241050
1037,2,5,"in a room with lots of windows  i get no glare on the screen.",0,0,4,0.530126,0.129329
1037,2,6,"i really haven t found any  but i m not an audiophile  nor am i particularly techy about anything but computers  not into ipod  mp3s  etc.  tivo.",1,0,0,0.573126,0.156283
1037,2,7,"give me a dvd player  digital cable  and i m happy enough.",1,0,0,0.490048,0.221437
1038,2,0,"hd tuner is crystal clear.",0,0,7,1.000000,1.000000
1038,2,1,"picture is very nice.",0,0,6,0.629940,0.242761
1038,2,2,"biggest computer monitor i have.",0,0,3,0.601612,0.204507
1038,2,3,"nice tv.",0,0,3,0.606741,0.242761
1038,2,4,"box was almost destroyed upon delivery.",1,1,13,0.550052,0.202993
1038,2,5,"it was obviously dropped on the side.",1,1,13,0.555354,0.155057
1038,2,6,"tv works great with no problems.",1,1,11,0.525616,0.128282
1038,2,7,"broken piece of plastic wedged under the lcd screen but i cant figure out where it came from.",1,1,11,0.506992,0.141140
1039,2,0,"no dead pixels.",0,1,8,1.000000,1.000000
1039,2,1,"the tv scales accurately to 1080p from all but one hdmi port for some reason.",0,1,9,0.587289,0.129329
1039,2,2,"overall a great value for the price.",0,1,8,0.603717,0.242761
1039,2,3,"no rca input for sound from the vga port.",1,0,7,0.618055,0.309503
1039,2,4,"the component video input shares sound with the composite rca.",1,0,7,0.162835,0.107632
1040,2,0,"i bought this from a brick and mortar store because a 5 year protection plan was available.",0,0,4,1.000000,1.000000
1040,2,1,"i bought this tv to use both as a computer monitor and tv.",0,0,3,0.360198,0.083764
1040,2,2,"as a monitor the one requirement that it absolutely had to have was 4k  60hz  4 4 4 chroma subsampling.",0,0,3,0.538562,0.188017
1040,2,3,"for pc  older or less expensive uhd or hd tvs may use 4 2 2 or 4 2 0 which compress the signal.",0,0,7,0.375068,0.168503
1040,2,4,"sources other than pc don t use 4 4 4.",0,0,7,0.183605,0.071711
1040,2,5,"this tv has hdmi 2.0 which is the only version so far that can do 4 4 4.",0,0,2,0.196381,0.091493
1040,2,6,"without 4 4 4 the picture quality is less that what you would have with a regular computer monitor.",0,0,2,0.269851,0.097568
1040,2,7,"without 4 4 4  i noticed that small black text on a red backround  uneven number of pixels  and excel charts looked bad  bars had compression artifacts or ghost image surrounding them.",0,0,0,0.415492,0.090468
1040,2,8,"lines were inconsistent color .",0,1,9,0.721342,0.171967
1040,2,9,"to get it to work you need these things   a nvidia geforce gtx 900 series or amd equivalent  use only hdmi port 1 on tv  set hdmi uhd color to on  and set device type to pc  press source  select port 1  then press tools  and select device type. ",0,1,9,0.362270,0.107130
1040,2,10,"once this is done the picture looks absolutely perfect.",0,1,8,0.638775,0.204507
1040,2,11,"also  dvi to hdmi cables will work  4k  60hz  4 4 4  and will work in any of the 3 other ports at lower resolutions and or frequencies.",0,1,9,0.652449,0.307512
1040,2,12,"the salesperson will try to sell you expensive cables.",0,1,9,0.598952,0.159559
1040,2,13,"he said  40 per cable was the minimum that i should spend.",0,1,9,0.175123,0.072948
1040,2,14,"you definitely do not need to buy expensive hdmi cable s  as long as they are 6 feet or less and you won t be plugging unplugging all the time.",0,1,9,0.178160,0.092670
1040,2,15,"the only requirement is that the cable be a  high speed  hdmi cable.",0,1,9,0.261534,0.079391
1040,2,16,"the free cable that came with my dvr works very well  4k  60hz  4 4 4.",0,1,14,0.463187,0.182787
1040,2,17,"however another  2.50 cable caused the pc audio and video to cut out for a second or two on rare occasion  so i used that one for my dvr  where it works good.",0,1,9,0.178585,0.147251
1040,2,18,"the colors are more vibrant than anything i ve seen before.",0,1,9,0.617730,0.202993
1040,2,19,"the framerate is interpolated to 60 hz  which i do notice sometimes.",0,1,8,0.558580,0.128282
1040,2,20,"the motion looks smoother in what is sometimes called the  soap opera effect .",0,1,8,0.576550,0.156283
1040,2,21,"the tv came with the eco sensor turned on.",0,1,9,0.594320,0.129329
1040,2,22,"it will dim the picture more in a darker room to save energy.",0,1,14,0.539546,0.156283
1040,2,23,"you can also set a minumum backlight brightness when it is turned on.",0,1,11,0.568101,0.129329
1040,2,24,"i measured that the tv uses 114 to 133 watts without eco sensor and about 39 to 44 watts with it on  but the picture is too dark imo .",0,1,9,0.635088,0.205708
1040,2,25,"it was about 73 to 74 watts with the minimum set to 5.  when playing video games on the pc  the input lag is low enough that it is not an issue at all.",0,1,9,0.167023,0.149463
1040,2,26,"some older video games sometimes  or always  crash when the resolution is set to 3840 x 2160.",0,1,9,0.092147,0.065208
1040,2,27,"i won t be using console  game mode  on this tv because i only play games on the pc.",0,1,9,0.300342,0.084774
1040,2,28,"at first i couldn t get the 4 4 4 to work because i didn t set the device type to pc.",1,1,9,0.526303,0.192327
1040,2,29,"i chatted with a samsung rep online and he didn t know enough about it to tell me that  and he wasn t even sure that it could do 4 4 4.",1,1,11,0.471987,0.184206
1040,2,30,"when i bought it  the salesman didn t seem to know either and so i almost returned it because i wasn t sure it could do 4 4 4.",1,1,11,0.228809,0.098392
1040,2,31,"the 3rd day  i figured it out on my own and all was good.",1,1,8,0.545389,0.204507
1040,2,32,"i tried hooking up my 20 year old yamaha yst m10 computer speakers  also 10w per channel  and they sounded so much better than the tv speakers that i will keep using them even though i can t control the volume with the remote control.",1,1,12,0.511823,0.242761
1040,2,33,"there is a stereo mini plug and an optical out on the back of the tv for this.",1,1,12,0.573880,0.129329
1040,2,34,"i also noticed that when using my computer the sound now comes through the hdmi cable and it is not initialized until the windows startup sound has almost finished playing  so you never hear the beginning of the startup sound.",1,1,12,0.589942,0.234011
1040,2,35,"when i first connected the tv to the internet  i couldn t get it to accept the wi fi password  so i connected the lan cable and it worked.",1,1,9,0.561643,0.226788
1040,2,36,"i later got the wi fi to work by pressing the wps button on my router  i need to use the one ethernet cable for the computer .",1,1,9,0.182688,0.076641
1040,2,37,"over the first 3 days  the tv used 2 to 3 gb of data and i only used the tv web browser for a few minutes.",1,1,9,0.619931,0.205708
1040,2,38,"i have a 10 gb limit per month with my satellite internet service so i need to be able to easily turn wireless on and off.",1,1,9,0.209558,0.081055
1040,2,39,"i chatted with a rep and he said there is no way to easily toggle connectivity on and off.",1,1,9,0.442663,0.182959
1040,2,40,"you can disconnect easily  but to turn it back on  you have to hit the wps button on the router again.",1,1,9,0.164521,0.077304
1040,2,41,"my router has a simple button that toggles the wireless on and off  so it is easier for me to do it that way.",1,1,9,0.343975,0.144922
