950,2,1,"incredible colors  amazing black levels  my eyes got exited playing fifa09 with my ps3 hooked via hdmi.",0,0,0,0.585005,0.242761
950,2,2,"unpacked  10 min later i was watching tv.",0,0,0,0.614922,0.242761
950,2,3,"easy setup.",0,0,6,0.558478,0.129329
950,2,4,"not really a con but spread a lot of heat in my living room.",1,1,13,0.512247,0.142275
951,2,0,"i didn t purchase this particular tv  but it s very similar.",0,0,4,1.000000,1.000000
951,2,1,"i do highly recommend buying a tv from newegg.com.",0,0,4,0.591345,0.204507
951,2,2,"this is my 3rd tv  the first 2 were niko lcd s  one was a 19  and the other was a 26 .",0,0,4,0.675217,0.264404
951,2,3,"i never had a problem with either one  i just decided to put the niko 26  in the bedroom and get a 50  plazma for the living room.",0,0,4,0.112745,0.157693
951,2,4,"i read a lot of reviews about lcd s and plazmas and it does seem to be a toss up.",0,0,4,0.595409,0.232693
951,2,5,"and now after owning both i can say it s still a toss up...they are both excellent...but the samsung is a far better tv than the niko.",0,0,4,0.584730,0.156283
951,2,6,"i also recommend dishnetwork...they have awesome hd programming.",0,0,2,0.614080,0.264404
951,2,7,"my lcd in the bedroom doesn t even have the hd box and the picture is phenomenal  way better than the charter we used to have.",0,0,2,0.287206,0.169172
951,2,8,"the remote that comes with dishnetwork controls all the tv controls too.",0,0,2,0.543256,0.142275
952,2,0,"this tv is a fantstic buy.",0,0,1,1.000000,1.000000
952,2,1,"i got it in january  so samsung still has the  200 nfl.com rebate  which is just an added bonus ",0,0,1,0.591373,0.156283
952,2,2,"the picture is amazing  and it is very user friendly.",0,0,1,0.570836,0.204507
952,2,3,"i had my tv 4 days after i purchased it ",0,1,14,0.662840,0.264404
952,2,4,"the speakers kind of suck  but hey  if you are buying a 50 inch plasma  you better be connecting it to a surround sound anyways.",1,1,12,0.300208,0.087203
952,2,5,"that said  the only other minor issue is i don t really like the remote  but again  buy a universal people.",1,1,14,0.438219,0.132527
953,2,0,"1.  hd over the air is excellent   internal tuner is great  2.  big 3.  swivel stand 4.  images on hdmi  cable and ota were crisp  but  see cons ...",0,0,2,1.000000,1.000000
953,2,1,"...the images from the vga  pc  and the component1  wii  were awful.",1,1,9,0.653970,0.254033
953,2,2,"there was a grayish tint to the images for these two inputs.",1,1,9,0.265375,0.079604
953,2,3,"i am using component cables for the wii and a dvi out from the pc and the image was just unacceptable.",1,1,9,0.250889,0.134534
953,2,4,"i m not sure if this is a plasma versus lcd issue  but it was just  gray .",1,1,8,0.571008,0.242761
953,2,5,"also  the adjustments were lacking  no separate color settings   and the overall image was just dark when i got the set home.",1,1,15,0.505004,0.141140
954,2,0,"this is the best picture i have seen.",0,0,6,1.000000,1.000000
954,2,1,"with the built in tuner all my sports games from nbc and cbs are in 1080i and fox is 720p.",0,1,15,0.591345,0.202993
954,2,2,"the descrambler lets me get my dtv channels from comcast without paying 80bucks a month for a box and the same channels.",0,0,1,0.611707,0.156283
954,2,3,"the burn in protection works very well.",0,0,1,0.694166,0.170642
954,2,4,"my wife and i fell asleep watching a dvd and the menu stayed on and stationary for about three hours  after runnning the anti burn scrolling grey  which does not reduce picture life  that and the pixel shift there was absolutley nothing there.",0,0,4,0.285768,0.103547
954,2,5,"blue ray looks perfect  checkout walle don t laugh it is amazing picture quality .",0,0,0,0.380009,0.144274
954,2,6,"too many pros too list",0,0,0,0.583415,0.241050
954,2,7,"if you have cable there will be some lines in the picture do to the 480i being sent from the cable company to the tv  not all channels  but don t worry if you see it.",1,0,0,0.502352,0.156283
954,2,8,"if you have multiple samsung products in one room the remote will turn those items on or off even if you don t want them to.",1,0,4,0.522167,0.141140
955,2,0,"if you re debating to buy plasma or not like i was stop.",0,0,1,1.000000,1.000000
955,2,1,"this tv is amazing.",0,0,6,0.638125,0.204507
955,2,2,"easy to set up.",0,0,6,0.584559,0.204507
955,2,3,"was watching tv in 10 minutes  very customizable to your liking.",0,0,3,0.577741,0.128282
955,2,4,"very attractive tv with a nice sturdy swivel base.",0,0,3,0.577798,0.242761
955,2,5,"pip is pretty cool also.",0,0,3,0.577856,0.204507
955,2,6,"sitting in my chair to long watching tv   you just can t help it.",1,0,3,0.614080,0.170642
955,2,7,"my wife gets a little irratated because i m always calling her over to look at the amazing picture when i m watching sports.",1,0,3,0.279209,0.167585
955,2,8,"the speakers on this set are not the greatest but no biggy since i m running it through my receiver.",1,1,12,0.539048,0.221437
956,2,0,"like many  i spent literally hours of research into televisions.",0,1,13,1.000000,1.000000
956,2,1,"i have an online subscription to that independent consumer testing agency  that cannot be named directly  but you know who it is  and it rated this tv a best buy  and was only 2 points below their best rated tv period  which was also a samsung.",0,1,11,0.672927,0.345867
956,2,2,"as before  they didn t let me down on their ratings and testing.",0,0,5,0.187453,0.136231
956,2,3,"deep blacks  no motion blur  awesome color even with the standard settings.",0,0,6,0.663675,0.307512
956,2,4,"a main concern of mine was how regular standard def channels displayed   and i am pleased with the results.",0,0,6,0.584342,0.246905
956,2,5,"many  if not most flat panel hd tvs display standard def horribly   some much worse than a crt.",0,0,6,0.256060,0.097326
956,2,6,"in some cases  the sd is actually better than crt.",0,0,5,0.622442,0.128282
956,2,7,"minimal glare as well which is unusual for a plasma  and even less than my old crt 36 .",0,0,4,0.573401,0.155057
956,2,8,"color and brightness not an issue even in my room full of windows and lights all the way on.",0,0,3,0.556939,0.129329
956,2,9,"oh  and the hd   so sharp and detailed its unbelieveable.",0,0,3,0.597672,0.156283
956,2,10,"all these cons are really minor to me  but the tv seems a bit wobbly on the stand mount.",1,1,13,0.550949,0.155057
956,2,11,"it does swivel  so maybe it just seems loose.",1,1,13,0.594167,0.129329
956,2,12,"hasn t been a problem though.",1,1,9,0.554532,0.202993
956,2,13,"it does throw some heat out  but since my family room is half underground in northern michigan  it stays cold all the time  so the little extra heat is just a welcome bonus for me and less i have to run the furnace.",1,1,9,0.514191,0.241050
956,2,14,"there is some glare.",1,1,13,0.574755,0.129329
956,2,15,"if your windows are facing the tv screen  i.e.",1,1,13,0.513578,0.156283
956,2,16,"behind you the viewer   it could be a problem.",1,1,13,0.549127,0.241050
956,2,17,"i have a lot of windows  but they are behind or to the side of the tv  and not really an issue for me.",1,1,13,0.489668,0.204507
956,2,18,"the black levels could be better  but you d pay hundreds or thousands more for the slight improvement that would bring  and i m really not sure how much blacker it could get anyway.",1,1,8,0.514775,0.141140
957,2,0,"wow   the picture is awesome.",0,0,6,1.000000,1.000000
957,2,1,"it was extremely easy to set up.",0,0,2,0.606265,0.242761
957,2,2,"took only 5 days to hand deliver.",0,0,5,0.607663,0.129329
957,2,3,"great picture with dvds.",0,0,2,0.688122,0.262593
957,2,4,"newegg has great prices vs box stores and no tax ",0,0,2,0.246082,0.080516
957,2,5,"that will save you hundreds of dollars alone.",0,0,2,0.603767,0.241050
957,2,6,"i can see why it was rated the top tv in the ratings.",0,0,2,0.530465,0.128282
957,2,7,"you can not go wrong with this tv from newegg.",0,0,2,0.573791,0.241050
957,2,8,"need 2 people to lift tv due to size not weight.",1,1,8,0.587739,0.309503
957,2,9,"comes attached to the stand   a con for me   i hung my tv on the wall and had to unscrew the 8 screws. ",1,1,8,0.329078,0.125433
958,2,0,"the product has served us without problem for three years.",0,1,11,1.000000,1.000000
958,2,1,"the delivery process was flawless.",0,1,13,0.611763,0.242761
958,2,2,"no cons.",1,1,13,0.571008,0.142275
959,2,0,"i saw this tv at best buy and could not tell it wasn t 1080p.",0,0,5,1.000000,1.000000
959,2,1,"i wanted to get a 1080p plasma but my wife would only go so far with the money.",0,0,5,0.280461,0.157626
959,2,2,"i ordered this tv from newegg and could not be happier with it.",0,0,5,0.610780,0.156283
959,2,3,"fast shipping great picture.",0,0,1,0.558985,0.242761
959,2,4,"lots of control over settings.",0,0,2,0.572441,0.204507
959,2,5,"did i say great picture.",0,0,1,0.558139,0.242761
959,2,6,"just buy it.",0,0,1,0.547242,0.221437
960,2,0,"i got this on sale for  1000  so i can t complain about that.",0,0,5,1.000000,1.000000
960,2,1,"sleek style and beautiful picture.",0,0,5,0.611679,0.202993
960,2,2,"sound quality sucks.",1,1,8,0.605034,0.129329
960,2,3,"there were two tiny 3 inch 10 watt speakers that started to crackle after a few days for certain frequencies.",1,1,9,0.543053,0.128282
960,2,4,"also  i occasionally get a robotic pitch after watching for a while.",1,1,9,0.584787,0.156283
960,2,5,"it fixes itself when you change the channel  but annoying nonetheless.",1,1,9,0.500969,0.142275
961,2,0,"incredible tv for the price.",0,0,2,1.000000,1.000000
961,2,1,"i had to buy mine locally since newegg does not ship tvs to hawaii.",0,0,2,0.668509,0.205708
961,2,2,"mine has little different product number  pn50b450d  but has the same specs.",0,0,4,0.366586,0.105265
961,2,3,"the picture is incredible.",0,0,6,0.600251,0.129329
961,2,4,"720p is all you need.",0,1,9,0.582777,0.129329
961,2,5,"more controls than you will ever need.",0,1,9,0.544166,0.156283
961,2,6,"could have used one more hdmi port.",1,1,9,0.505016,0.142275
962,2,0,"wow...ordered tuesday...delivered friday ...ca to il....newegg rocks when it comes to getting you your goods.",0,1,13,1.000000,1.000000
962,2,1,"not newegg s biggest customer but the biggest fan.",0,1,14,0.672164,0.262593
962,2,2,"got a deal at 949.00....3 days later newegg had it for 1199.00...hooked up tv and its beautiful....great value.",0,1,14,0.303590,0.193840
963,2,0,"lots of audio video connections for older game systems.",0,0,7,1.000000,1.000000
963,2,1,"just enough compenent connections.",0,0,7,0.270285,0.096113
963,2,2,"beautiful picture even at 720p.",0,0,6,0.543053,0.155057
963,2,3,"i love the tv.",1,0,6,0.567589,0.223050
964,2,0,"great picture no ps3 burn in lowest priced 50  plasma amazing",0,0,5,1.000000,1.000000
964,2,1,"i suppose its a bit heavy....but i did put it on the shelf myself but would def recommend 2 people for the job",1,1,12,0.467228,0.131264
965,2,0,"large screen.. hdmi ..hd.",0,0,0,1.000000,1.000000
965,2,1,"built in tuner.. great picture.",0,0,7,0.597518,0.221437
965,2,2,"got it for  999.99",0,0,0,0.613807,0.204507
965,2,3,"got it and my ps3 the same day even if it was suposed to arrive the 2nd of march",0,0,0,0.530465,0.156283
965,2,4,"heavy well 80lbs spaced awkwardly.",1,1,13,0.561366,0.141140
966,2,0,"great price when i ordered it  free shipping sealed the deal.",0,0,1,1.000000,1.000000
966,2,1,"720p is all i need at 10 feet away  swear you can t tell.",0,0,0,0.641367,0.202993
966,2,2,"plenty o jacks  nice look",0,0,0,0.638152,0.202993
966,2,3,"first one came in and i used it for 4 days w  no problem.",1,1,11,0.656380,0.264404
966,2,4,"only 4 hours of use in those 4 days cuz i wasn t really ready for it.",1,1,11,0.093615,0.131917
966,2,5,"treated it like a faberge egg.",1,1,11,0.611805,0.129329
966,2,6,"on the 5th day  still under 6 hours of use  it powered off 30 mins into wii session.",1,1,11,0.536036,0.156283
966,2,7,"dead.",1,1,11,0.594993,0.129329
966,2,8,"unit powers up and saw it attempted to flicker when hit  source  on remote  but nothin  but black.",1,1,11,0.516409,0.155057
966,2,9,"newegg was nice  rma  charges me no shipping  and swapped tvs when teh new one came in  savign me an extra  week w  no tv.",1,1,14,0.527628,0.242761
966,2,10,"2nd one works great... for now.",1,1,11,0.559196,0.128282
966,2,11,"been 2 months  no problems yet.",1,1,11,0.504543,0.221437
967,2,0,"beautiful picture  amazing 3d.",0,0,6,1.000000,1.000000
967,2,1,"magic remote was faulty  only power button worked and lg gave me a few things to try but was faulty in the end.",1,1,11,0.674587,0.307512
967,2,2,"didn t feel like going through rma  to return 1 remote so went to a competitor s website and bought a brand new one.",1,1,11,0.371233,0.088521
967,2,3," seriously newegg  i could not say that name ",1,1,11,0.593932,0.155057
967,2,4," 4 eggs for your attitude  ",1,1,11,0.512247,0.142275
968,2,0,"2 hdmi ports and weight towards the bottom of the tv is great for having the tv sitting on a counter",0,0,0,1.000000,1.000000
968,2,1,"is kind of bulky depth wise.",1,1,13,0.626037,0.202993
968,2,2,"also the buttons are on the left side of the tv instead of the front  so if you lose your remote you have to pull the tv out and see which buttons do what.",1,1,13,0.514999,0.141140
969,2,0,"replacement for a 7 year old unit that died.",0,1,11,1.000000,1.000000
969,2,1,"used as a tv and monitor",0,1,11,0.601739,0.142275
970,2,0,"this is a great hdtv and pc monitor.",0,0,3,1.000000,1.000000
970,2,1,"my games look great with no lag whatsoever on the pc.",0,0,3,0.184743,0.090120
970,2,2,"skyrim on 1920x1080 looks simply amazing.",0,0,3,0.611763,0.128282
970,2,3,"it couldn t look any better while watching movies either.",0,0,3,0.557032,0.241050
970,2,4,"it works great ",1,0,3,0.646963,0.264404
970,2,5,"great price for what you get.",1,0,3,0.186325,0.110328
971,2,0,"worked the first week that i tried it   so i put it up until i needed it.",0,0,1,1.000000,1.000000
971,2,1,"i need it a year later.",0,0,3,0.638125,0.129329
971,2,2,"the reason i bought it was that it was a 1080p resolution.",0,0,3,0.574235,0.129329
971,2,3,"of course i needed it 1 yr and 2 weeks later.",1,1,14,0.601654,0.155057
971,2,4,"guess what ",1,1,8,0.605090,0.129329
971,2,5,"no picture  no light on screen  no nothing ",1,1,8,0.536065,0.129329
971,2,6,"it does chime when turned on and off  tho.",1,1,8,0.577913,0.156283
971,2,7,"how do i get a fricken picture and sound   ",1,1,8,0.515057,0.156283
971,2,8,"i guess i can use it for a  160 door chime.",1,1,8,0.522167,0.141140
972,2,0,"this is the second one of these i have purchased.",0,1,9,1.000000,1.000000
972,2,1,"makes a great bedroom tv and doubles as a computer monitor.",0,1,9,0.550052,0.223050
973,2,0,"great screen.",0,0,7,1.000000,1.000000
973,2,1,"many ways to change picture.",0,0,7,0.614539,0.241050
973,2,2,"thin bevel.",0,0,7,0.617473,0.128282
973,2,3,"built in speaker is very good.",0,0,7,0.552011,0.242761
973,2,4,"very thin.",0,0,7,0.589628,0.242761
973,2,5,"2 hdmi inputs.",1,0,7,0.516031,0.129329
973,2,6,"only way to connect external audio is via optical out  i m using a sound bar .",1,1,12,0.505016,0.142275
974,2,0,"i refuse to write anything nice about this purchase",0,1,13,1.000000,1.000000
974,2,1,"the tv cuts off all the time by itself.",1,1,13,0.627670,0.204507
974,2,2,"it s that simple.",1,1,13,0.583278,0.129329
974,2,3,"newegg can take their crumby products and stick em.",1,1,13,0.537493,0.155057
974,2,4,"i ll stick to shopping at a different online retailer.",1,1,13,0.554399,0.142275
975,2,0,"great image  color is very good after slight tweaking in the menus  plays videos from a thumb drive  lots of different codecs   looks very sleek with the thin bezel  exception noted in the  cons  section .",0,0,0,1.000000,1.000000
975,2,1,"also  has an audio output jack that a headphone can plug into  3.5mm",0,0,7,0.645561,0.241050
975,2,2,"has a great  game mode  with very low input lag  not noticeable to me when i use it for pc games via hdmi .",0,0,0,0.651008,0.264404
975,2,3,"sleek bezel has this odd one inch square plastic bit hanging down for the remote sensor  and its off to one side on the bottom  and has an always on red led so its hard not to notice it.",1,1,9,0.593707,0.254205
975,2,4,"not sure why it couldn t be put in the center bottom with the samsung logo.",1,1,13,0.363353,0.106451
975,2,5,"also  the audio out jack on the back is at a fixed level  so if you plug in headphones there  they are at a fixed level and not very loud  and the volume is disabled if you turn off the internal speakers.",1,1,9,0.605463,0.171967
975,2,6,"in  game mode  you cannot adjust picture properties  you must adjust them prior to turning on game mode.",1,1,12,0.450204,0.156677
976,2,0,"beautiful sound sturdy",0,0,7,1.000000,1.000000
976,2,1,"the stand does seem a bit cheap but i ve had no problems with it picture always seems blurry to me",1,1,13,0.545855,0.221437
977,2,0,"good tv for a price.",0,0,6,1.000000,1.000000
977,2,1,"full 1080p hd  clear and crisp image   colors are very bright and vibrant.",0,0,6,0.570793,0.242761
977,2,2,"the menu and controls are a bit wonky  and instructions are not helpful.",1,1,15,0.591543,0.129329
977,2,3,"had to research some stuff  see other thoughts below.",1,1,8,0.571052,0.141140
978,2,0,"good price",0,0,6,1.000000,1.000000
978,2,1,"won t stand on the provided base and the remote doesn t work",1,0,0,0.545855,0.223050
979,2,0,"beautiful tv.",0,0,2,1.000000,1.000000
979,2,1,"very thin.",0,0,2,0.607663,0.156283
979,2,2,"best price for the tech.",0,0,4,0.555586,0.204507
979,2,3,"ait worldwide logistics delivered it very damaged.",1,1,13,0.572357,0.202993
979,2,4,"i suggest newegg gets with shipping company to make sure tvs are not just thrown around and are placed in secondary boxes with extra supports.",1,1,14,0.503171,0.142275
980,2,0,"good tv",0,0,6,1.000000,1.000000
980,2,1,"i ordered it and it came with the base and the tv but no way to connect the two.",1,1,9,0.574249,0.204507
980,2,2,"you would expect them to have all the parts for anything regardless whether or not it was used or not.",1,1,8,0.598349,0.155057
980,2,3,"i didnt buy this from a yards sale you know.",1,1,8,0.518569,0.141140
981,2,0,"picture is beautiful",0,0,6,1.000000,1.000000
981,2,1,"had it out of the box for 6 hours  on for 3. stopped working already..",1,1,10,0.577009,0.155057
981,2,2,"pretty depressing.",1,1,10,0.603767,0.128282
981,2,3,"turns off after a few minutes of being on then wont turn on again unless you unplug it for a while.",1,1,9,0.511515,0.163648
982,2,0,"nice picture.",0,0,6,1.000000,1.000000
982,2,1,"reasonable price.",0,0,2,0.601612,0.202993
982,2,2,"poor speakers.",1,1,12,0.591543,0.241050
982,2,3,"tv lasted just over 25 months.",1,1,11,0.518569,0.221437
983,2,0,"as i mentioned before quality was good.",0,0,5,1.000000,1.000000
983,2,1,"sound is terrible",1,1,12,0.584701,0.221437
984,2,0,"what a great tv at a great price.",0,0,1,1.000000,1.000000
984,2,1,"beautiful picture  no dead pixels  and served as my pc gaming monitor for about a year.",0,0,3,0.668357,0.307512
984,2,2,"i don t know how the panel industry has shifted in the last few years  but when i compare this tv to newer ones i still appreciate the quality and price.",0,0,3,0.362523,0.105567
984,2,3,"remote is finicky  but flashing a new firmware seemed to broaden the range ",1,1,10,0.583380,0.156283
984,2,4,"i m not sure what s up with that  but i was happy.",1,1,10,0.554399,0.221437
985,2,0,"crisp clear great tv for the price.",0,0,6,1.000000,1.000000
985,2,1,"slight lag when turning on the tv.",1,1,9,0.611763,0.204507
985,2,2,"tv jwill not function untill you have the perfect angle with the remote.",1,1,13,0.529092,0.223050
986,2,0,"  this is a unique model  the picture is amazing   clear  crisp   what makes it more unique is that the sound on this particular toshiba model is amazing   3 hdmi ports   all 3 ports running strong",0,0,7,1.000000,1.000000
986,2,1,"when all 3 hdmi ports are connected simultaneously  when switching from one to the other picture may disrupt causing you to get up and manually unplug and then re plug the hdmi cable.",1,1,9,0.244587,0.178691
987,2,0,"excellent build quality  features and picture quality.",0,0,6,1.000000,1.000000
987,2,1,"my games and blu ray s look excellent.",0,0,6,0.377408,0.104389
987,2,2,"i for one  love the glossy bezel and screen.",0,0,2,0.570922,0.129329
987,2,3,"highly recommended for the price.",0,0,1,0.539677,0.142275
988,2,0,"stunning picture.",0,0,1,1.000000,1.000000
988,2,1,"after several months i am still amazed at the quality of the picture and the build of this tv.",0,0,1,0.305286,0.192796
989,2,0,"i love the image quality  the colors  the features.",0,0,6,1.000000,1.000000
989,2,1,"three hdmi in the rear is a nice additional and it will control my old dvr when it s plugged in  a magnavox .",0,1,11,0.601612,0.156283
989,2,2,"however it will not play video off my usb devices.",1,0,0,0.660944,0.309503
989,2,3,"it s a  feature  of the tv that it won t play video.",1,0,0,0.192806,0.110328
990,2,0,"what a great deal  part of an email flyer sale with a promo code and free shipping ",0,0,1,1.000000,1.000000
990,2,1,"you bet   439 is quite a steal and it helps that it s a toshiba so i feel a little more comfortable but i m still keeping my eyes open on how it will operate.",0,0,1,0.601612,0.156283
990,2,2,"seen a few people mention cons  so i will hope that i will not have the same.",0,1,8,0.579204,0.241050
990,2,3,"none at this point.",1,1,8,0.571052,0.141140
991,2,0,"great picture  and great looking tv.",0,0,1,1.000000,1.000000
991,2,1,"after 4 months  the screen started displaying strait lines across  so the main board had to be swapped  told by tv repair shop .",1,0,1,0.653228,0.309503
991,2,2,"toshiba does not even have that part in stock so i have been without a tv for 3 weeks already and still waiting for them to ship the part.",1,0,1,0.403292,0.128390
992,2,0,"works great ",0,0,1,1.000000,1.000000
992,2,1,"gives 60hz under windows 8. replaced 2 28  monitors with one of these and it is sooooo much better.",0,0,3,0.643570,0.309503
992,2,2,"using with a evga gtx 980 sc fyi",0,0,3,0.099604,0.094238
993,2,0,"the image quality is excellent.",0,0,6,1.000000,1.000000
993,2,1,"playing ps3 on it is a dream  vivid colors  great tv and awesome sound.",0,0,0,0.588445,0.129329
993,2,2,"this is nitpicking  but it doesn t display the time when you press the display button  my older tv used to do it.",1,1,15,0.597295,0.242761
993,2,3,"just hard to break the habit  i guess.",1,1,15,0.605118,0.156283
993,2,4,"also  doesn t let you turn off inputs  so you have to shuffle through them all to get to the one you want.",1,1,15,0.529092,0.128282
993,2,5,"other tvs let you do this or rename them.",1,1,15,0.550227,0.142275
994,2,0,"we ve owned two of these for a couple of years now  were around  1 000 then  and they are still working 100 .",0,0,3,1.000000,1.000000
994,2,1,"i have two pc s connected to mine   one via vga  and one via hdmi and they both look amazing at native resolution of 1360x768.",0,0,3,0.676356,0.264404
994,2,2,"most new games support the resolution as well  and if not this baby supports most popular aspect ratios anyway.",0,0,3,0.394104,0.143899
994,2,3,"with the p.i.p. i can have both pc s on the screen at once for mmo power gaming       the picture while watching hdtv is as amazing as hd can be.",0,0,0,0.624889,0.307512
994,2,4,"i can t afford another one..  but that s not there fault  this is an amazing deal.",1,0,0,0.355349,0.123323
995,2,0,"cheap  720p  hdmi s  great size for my location.",0,0,0,1.000000,1.000000
995,2,1,"doesn t have that glossy finish like those samsungs   ",1,1,10,0.603767,0.221437
996,2,0,"great picture.",0,0,6,1.000000,1.000000
996,2,1,"displays 1080p even though it says its a 720p tv.",0,0,5,0.594117,0.241050
996,2,2,"decent sound.",0,0,6,0.596940,0.129329
996,2,3,"confusing menu system  but you get used to it.",1,0,6,0.558478,0.128282
996,2,4,"decent sound.",1,0,6,0.533383,0.141140
997,2,0,"worked good for 1yr.",0,1,11,1.000000,1.000000
997,2,1,"and 2 months  and yes the warranty is for 1 yr. was happy with it till it suddenly quit working  it will not power up  looking at a totally black screen.",0,1,11,0.327245,0.103896
997,2,2,"called support tried unplugging everything for a couple of hours as told but i had already tried this before with same results  dead lcd hdtv",0,1,8,0.592402,0.202993
997,2,3,"i guess this is just a high priced throw away product.",1,1,8,0.576303,0.155057
997,2,4,"if the main board costs  400 to fix this  what fool would go that route.",1,1,11,0.554399,0.141140
998,2,0,"low price.",0,0,4,1.000000,1.000000
998,2,1,"the warm up time grows longer and longer until after 6 months it won t turn on at all.",1,1,11,0.566680,0.155057
998,2,2,"all i had was a constant blue light and no response with buttons or remote.",1,1,15,0.550139,0.142275
999,2,0,"a very good price on a second best in class product  according to consumerreports.",0,0,6,1.000000,1.000000
999,2,1,"i ve been extremely happy with this television so far.",0,0,6,0.614539,0.156283
999,2,2,"looks good  has plenty of connections  and is actually only a one person lift  despite claims on the box to the contrary.",0,0,6,0.587039,0.128282
999,2,3,"very strange on screen menu system.",1,1,12,0.600251,0.241050
999,2,4,"takes some time to get used to.",1,1,15,0.582777,0.129329
999,2,5,"cycling through all inputs to get to the one you want.",1,1,15,0.544166,0.128282
999,2,6,"incredibly bright blue  off  led  which turns on when the tv turns off  can be disabled from menu .",1,1,15,0.489887,0.142275
1000,2,0,"i bought a refurbished unit and can t say enough good things about it.",0,0,4,1.000000,1.000000
1000,2,1,"great picture in both hd and sd.",0,0,6,0.627653,0.128282
1000,2,2,"i looked for a long time before finally settling on the 537h.",0,0,2,0.672164,0.264404
